budget,genres,homepage,id,keywords,original_language,original_title,overview,popularity,production_companies,production_countries,release_date,revenue,runtime,spoken_languages,status,tagline,title,vote_average,vote_count
60000000,"[{""id"": 28, ""name"": ""Action""}, {""id"": 12, ""name"": ""Adventure""}, {""id"": 35, ""name"": ""Comedy""}]",http://www.scottpilgrimthemovie.com/,22538,"[{""id"": 170335, ""name"": ""whipping""}, {""id"": 175297, ""name"": ""hipster""}, {""id"": 175301, ""name"": ""underage girlfriend""}, {""id"": 175309, ""name"": ""animated flashback""}, {""id"": 175314, ""name"": ""character's point of view camera shot""}, {""id"": 175316, ""name"": ""unconsciousness""}, {""id"": 175321, ""name"": ""girl fight""}, {""id"": 175322, ""name"": ""vegan""}, {""id"": 179430, ""name"": ""aftercreditsstinger""}]",en,Scott Pilgrim vs. the World,"Scott Pilgrim is a film adaptation of the critically acclaimed, award-winning series of graphic novels of the same name by Canadian cartoonist Bryan Lee O’Malley. Scott Pilgrim is a 23 year old Canadian slacker and wannabe rockstar who falls in love with an American delivery girl, Ramona V. Flowers, and must defeat her seven ""evil exes"" to be able to date her.",38.885195,"[{""name"": ""Universal Pictures"", ""id"": 33}, {""name"": ""Marc Platt Productions"", ""id"": 2527}]","[{""iso_3166_1"": ""US"", ""name"": ""United States of America""}, {""iso_3166_1"": ""CA"", ""name"": ""Canada""}]",2010-07-27,47664559,112.0,"[{""iso_639_1"": ""en"", ""name"": ""English""}]",Released,Get the hot girl. Defeat her evil exes. Hit love where it hurts.,Scott Pilgrim vs. the World,7.2,2126
65000000,"[{""id"": 80, ""name"": ""Crime""}, {""id"": 18, ""name"": ""Drama""}, {""id"": 9648, ""name"": ""Mystery""}, {""id"": 53, ""name"": ""Thriller""}]",,1949,"[{""id"": 387, ""name"": ""california""}, {""id"": 582, ""name"": ""san francisco""}, {""id"": 627, ""name"": ""killing""}, {""id"": 736, ""name"": ""journalist""}, {""id"": 918, ""name"": ""newspaper""}, {""id"": 1583, ""name"": ""mass murder""}, {""id"": 3152, ""name"": ""planned murder""}, {""id"": 4123, ""name"": ""embassy""}, {""id"": 4399, ""name"": ""victim""}, {""id"": 4923, ""name"": ""threat to death""}, {""id"": 4942, ""name"": ""victim of murder""}, {""id"": 4950, ""name"": ""code""}, {""id"": 6149, ""name"": ""police""}, {""id"": 9826, ""name"": ""murder""}, {""id"": 10714, ""name"": ""serial killer""}, {""id"": 12193, ""name"": ""reporter""}]",en,Zodiac,"The true story of the investigation of 'The Zodiac Killer',  a serial killer who terrified the San Francisco Bay Area, taunting police with his ciphers and letters. The case becomes an obsession for four men as their lives and careers are built and destroyed by the endless trail of clues.",51.970905,"[{""name"": ""Paramount Pictures"", ""id"": 4}, {""name"": ""Warner Bros."", ""id"": 6194}, {""name"": ""Phoenix Pictures"", ""id"": 11317}]","[{""iso_3166_1"": ""US"", ""name"": ""United States of America""}]",2007-03-02,84785914,157.0,"[{""iso_639_1"": ""en"", ""name"": ""English""}]",Released,There's more than one way to lose your life to a killer.,Zodiac,7.3,2023
80000000,"[{""id"": 16, ""name"": ""Animation""}, {""id"": 10751, ""name"": ""Family""}]",,11544,"[{""id"": 1156, ""name"": ""sister sister relationship""}, {""id"": 1603, ""name"": ""extraterrestrial technology""}, {""id"": 1668, ""name"": ""hawaii""}, {""id"": 2393, ""name"": ""adoption""}, {""id"": 2766, ""name"": ""mutation""}, {""id"": 4862, ""name"": ""alien life-form""}, {""id"": 4939, ""name"": ""alien phenomenons""}, {""id"": 10336, ""name"": ""animation""}, {""id"": 15162, ""name"": ""dog""}, {""id"": 168490, ""name"": ""dead parents""}]",en,Lilo & Stitch,"A lonely Hawaiian girl named Lilo is being raised by her older sister, Nani, after their parents die -- under the watch of social worker Cobra Bubbles. When Lilo adopts a funny-looking dog and names him ""Stitch,"" she doesn't realize her new best friend is a wacky alien created by mad scientist Dr. Jumba.",55.659988,"[{""name"": ""Walt Disney Pictures"", ""id"": 2}, {""name"": ""Walt Disney Feature Animation"", ""id"": 10217}]","[{""iso_3166_1"": ""US"", ""name"": ""United States of America""}]",2002-06-21,145771527,85.0,"[{""iso_639_1"": ""en"", ""name"": ""English""}]",Released,He's coming to our galaxy.,Lilo & Stitch,7.1,1314
80000000,"[{""id"": 18, ""name"": ""Drama""}, {""id"": 53, ""name"": ""Thriller""}, {""id"": 9648, ""name"": ""Mystery""}]",http://www.shutterisland.com/,11324,"[{""id"": 818, ""name"": ""based on novel""}, {""id"": 2041, ""name"": ""island""}, {""id"": 2215, ""name"": ""hurricane""}, {""id"": 5340, ""name"": ""investigation""}, {""id"": 10323, ""name"": ""psychiatric hospital""}, {""id"": 11207, ""name"": ""u.s. marshal""}, {""id"": 11208, ""name"": ""conspiracy theory""}, {""id"": 208611, ""name"": ""1950s""}]",en,Shutter Island,"World War II soldier-turned-U.S. Marshal Teddy Daniels investigates the disappearance of a patient from a hospital for the criminally insane, but his efforts are compromised by his troubling visions and also by a mysterious doctor.",81.914696,"[{""name"": ""Paramount Pictures"", ""id"": 4}, {""name"": ""Appian Way"", ""id"": 562}, {""name"": ""Phoenix Pictures"", ""id"": 11317}, {""name"": ""Sikelia Productions"", ""id"": 23243}]","[{""iso_3166_1"": ""US"", ""name"": ""United States of America""}]",2010-02-18,294804195,138.0,"[{""iso_639_1"": ""en"", ""name"": ""English""}, {""iso_639_1"": ""de"", ""name"": ""Deutsch""}]",Released,Someone is missing.,Shutter Island,7.8,6336
80000000,"[{""id"": 53, ""name"": ""Thriller""}, {""id"": 80, ""name"": ""Crime""}, {""id"": 18, ""name"": ""Drama""}]",,4147,"[{""id"": 18712, ""name"": ""based on graphic novel""}, {""id"": 174984, ""name"": ""homework""}, {""id"": 174985, ""name"": ""shot in the chin""}, {""id"": 174994, ""name"": ""soft boiled egg""}, {""id"": 175001, ""name"": ""learning to drive""}, {""id"": 175005, ""name"": ""spoiled son""}, {""id"": 175007, ""name"": ""scarred face""}, {""id"": 175008, ""name"": ""thompson sub machine gun""}, {""id"": 175011, ""name"": ""frost on a window""}, {""id"": 175016, ""name"": ""cauterizing a wound""}, {""id"": 175017, ""name"": ""liberty half dollar""}]",en,Road to Perdition,"Mike Sullivan works as a hit man for crime boss John Rooney. Sullivan views Rooney as a father figure, however after his son is witness to a killing, Mike Sullivan finds himself on the run in attempt to save the life of his son and at the same time looking for revenge on those who wronged him.",49.078546,"[{""name"": ""DreamWorks SKG"", ""id"": 27}, {""name"": ""The Zanuck Company"", ""id"": 80}, {""name"": ""Twentieth Century Fox Film Corporation"", ""id"": 306}]","[{""iso_3166_1"": ""US"", ""name"": ""United States of America""}]",2002-07-12,181001478,117.0,"[{""iso_639_1"": ""en"", ""name"": ""English""}]",Released,Pray for Michael Sullivan.,Road to Perdition,7.3,1077
68000000,"[{""id"": 10752, ""name"": ""War""}, {""id"": 18, ""name"": ""Drama""}, {""id"": 28, ""name"": ""Action""}]",,228150,"[{""id"": 1956, ""name"": ""world war ii""}, {""id"": 2652, ""name"": ""nazis""}, {""id"": 6091, ""name"": ""war""}, {""id"": 11064, ""name"": ""nazi germany""}, {""id"": 11102, ""name"": ""panzer""}, {""id"": 11117, ""name"": ""tank""}]",en,Fury,"Last months of World War II in April 1945. As the Allies make their final push in the European Theater, a battle-hardened U.S. Army sergeant in the 2nd Armored Division named Wardaddy commands a Sherman tank called ""Fury"" and its five-man crew on a deadly mission behind enemy lines. Outnumbered and outgunned, Wardaddy and his men face overwhelming odds in their heroic attempts to strike at the heart of Nazi Germany.",139.575085,"[{""name"": ""Columbia Pictures"", ""id"": 5}, {""name"": ""QED International"", ""id"": 11029}, {""name"": ""Crave Films"", ""id"": 16312}, {""name"": ""LStar Capital"", ""id"": 34034}, {""name"": ""Huayi Brothers Media"", ""id"": 39649}, {""name"": ""Le Grisbi Productions"", ""id"": 47169}]","[{""iso_3166_1"": ""GB"", ""name"": ""United Kingdom""}, {""iso_3166_1"": ""US"", ""name"": ""United States of America""}, {""iso_3166_1"": ""CN"", ""name"": ""China""}]",2014-10-15,211817906,135.0,"[{""iso_639_1"": ""en"", ""name"": ""English""}]",Released,War never ends quietly.,Fury,7.4,3946
60000000,"[{""id"": 18, ""name"": ""Drama""}, {""id"": 10749, ""name"": ""Romance""}]",http://www.abeautifulmind.com/,453,"[{""id"": 30, ""name"": ""individual""}, {""id"": 222, ""name"": ""schizophrenia""}, {""id"": 1700, ""name"": ""massachusetts""}, {""id"": 2038, ""name"": ""love of one's life""}, {""id"": 2051, ""name"": ""intelligence""}, {""id"": 2303, ""name"": ""mathematician""}, {""id"": 2304, ""name"": ""market economy""}, {""id"": 2305, ""name"": ""economic theory""}, {""id"": 2307, ""name"": ""princeton university""}, {""id"": 2309, ""name"": ""nobel prize""}, {""id"": 2461, ""name"": ""mathematical theorem""}, {""id"": 2462, ""name"": ""m.i.t.""}, {""id"": 6009, ""name"": ""mathematics""}, {""id"": 6262, ""name"": ""delusion""}]",en,A Beautiful Mind,"At Princeton University, John Nash struggles to make a worthwhile contribution to serve as his legacy to the world of mathematics. He finally makes a revolutionary breakthrough that will eventually earn him the Nobel Prize. After graduate school he turns to teaching, becoming romantically involved with his student Alicia. Meanwhile the government asks his help with breaking Soviet codes, which soon gets him involved in a terrifying conspiracy plot. Nash grows more and more paranoid until a discovery that turns his entire world upside down. Now it is only with Alicia's help that he will be able to recover his mental strength and regain his status as the great mathematician we know him as today..",59.248437,"[{""name"": ""Imagine Entertainment"", ""id"": 23}, {""name"": ""DreamWorks SKG"", ""id"": 27}, {""name"": ""Universal Pictures"", ""id"": 33}]","[{""iso_3166_1"": ""US"", ""name"": ""United States of America""}]",2001-12-11,313542341,135.0,"[{""iso_639_1"": ""en"", ""name"": ""English""}]",Released,I need to believe that something extra ordinary is possible...,A Beautiful Mind,7.7,3009
45000000,"[{""id"": 10751, ""name"": ""Family""}, {""id"": 16, ""name"": ""Animation""}, {""id"": 18, ""name"": ""Drama""}]",http://movies.disney.com/the-lion-king,8587,"[{""id"": 2143, ""name"": ""loss of parents""}, {""id"": 5276, ""name"": ""wild boar""}, {""id"": 6464, ""name"": ""uncle""}, {""id"": 11326, ""name"": ""shaman""}, {""id"": 11436, ""name"": ""redemption""}, {""id"": 13084, ""name"": ""king""}, {""id"": 14767, ""name"": ""scar""}, {""id"": 18136, ""name"": ""hyena""}, {""id"": 18153, ""name"": ""meerkat""}]",en,The Lion King,A young lion cub named Simba can't wait to be king. But his uncle craves the title for himself and will stop at nothing to get it.,90.457886,"[{""name"": ""Walt Disney Pictures"", ""id"": 2}, {""name"": ""Walt Disney Feature Animation"", ""id"": 10217}]","[{""iso_3166_1"": ""US"", ""name"": ""United States of America""}]",1994-06-23,788241776,89.0,"[{""iso_639_1"": ""en"", ""name"": ""English""}]",Released,Life's greatest adventure is finding your place in the Circle of Life.,The Lion King,8.0,5376
76000000,"[{""id"": 16, ""name"": ""Animation""}, {""id"": 35, ""name"": ""Comedy""}, {""id"": 10751, ""name"": ""Family""}]",http://www.despicableme.com/,93456,"[{""id"": 4289, ""name"": ""secret agent""}, {""id"": 7397, ""name"": ""bakery""}, {""id"": 13072, ""name"": ""falling in love""}, {""id"": 15300, ""name"": ""father daughter relationship""}, {""id"": 179431, ""name"": ""duringcreditsstinger""}, {""id"": 184783, ""name"": ""first date""}, {""id"": 190999, ""name"": ""minions""}, {""id"": 209714, ""name"": ""3d""}]",en,Despicable Me 2,Gru is recruited by the Anti-Villain League to help deal with a powerful new super criminal.,136.886704,"[{""name"": ""Universal Pictures"", ""id"": 33}, {""name"": ""Illumination Entertainment"", ""id"": 6704}]","[{""iso_3166_1"": ""US"", ""name"": ""United States of America""}]",2013-06-25,970761885,98.0,"[{""iso_639_1"": ""en"", ""name"": ""English""}]",Released,Back 2 Work,Despicable Me 2,7.0,4637
76000000,"[{""id"": 18, ""name"": ""Drama""}, {""id"": 28, ""name"": ""Action""}, {""id"": 53, ""name"": ""Thriller""}, {""id"": 878, ""name"": ""Science Fiction""}]",http://www.universalstudiosentertainment.com/children-of-men/,9693,"[{""id"": 318, ""name"": ""police state""}, {""id"": 458, ""name"": ""hippie""}, {""id"": 526, ""name"": ""rebel""}, {""id"": 2618, ""name"": ""miracle""}, {""id"": 2964, ""name"": ""future""}, {""id"": 4565, ""name"": ""dystopia""}, {""id"": 4630, ""name"": ""chaos""}, {""id"": 4995, ""name"": ""aging""}, {""id"": 5885, ""name"": ""childlessness""}, {""id"": 6150, ""name"": ""faith""}, {""id"": 10349, ""name"": ""survival""}, {""id"": 17985, ""name"": ""birth""}, {""id"": 41589, ""name"": ""dying""}]",en,Children of Men,"In 2027, in a chaotic world in which humans can no longer procreate, a former activist agrees to help transport a miraculously pregnant woman to a sanctuary at sea, where her child's birth may help scientists save the future of humankind.",35.387874,"[{""name"": ""Universal Pictures"", ""id"": 33}, {""name"": ""Strike Entertainment"", ""id"": 655}, {""name"": ""Hit & Run Productions"", ""id"": 11429}]","[{""iso_3166_1"": ""GB"", ""name"": ""United Kingdom""}, {""iso_3166_1"": ""US"", ""name"": ""United States of America""}]",2006-09-22,69959751,109.0,"[{""iso_639_1"": ""en"", ""name"": ""English""}]",Released,The future's a thing of the past.,Children of Men,7.4,2071
75000000,"[{""id"": 53, ""name"": ""Thriller""}, {""id"": 80, ""name"": ""Crime""}]",,75656,"[{""id"": 90, ""name"": ""paris""}, {""id"": 974, ""name"": ""bank""}, {""id"": 1328, ""name"": ""secret""}, {""id"": 1812, ""name"": ""fbi""}, {""id"": 1953, ""name"": ""vault""}, {""id"": 2343, ""name"": ""magic""}, {""id"": 2411, ""name"": ""new orleans""}, {""id"": 5340, ""name"": ""investigation""}, {""id"": 10051, ""name"": ""heist""}, {""id"": 10410, ""name"": ""conspiracy""}, {""id"": 10594, ""name"": ""money""}, {""id"": 10685, ""name"": ""escape""}, {""id"": 14512, ""name"": ""new york city""}, {""id"": 14570, ""name"": ""las vegas""}, {""id"": 14601, ""name"": ""explosion""}]",en,Now You See Me,An FBI agent and an Interpol detective track a team of illusionists who pull off bank heists during their performances and reward their audiences with the money.,71.124686,"[{""name"": ""Summit Entertainment"", ""id"": 491}, {""name"": ""K/O Paper Products"", ""id"": 7296}, {""name"": ""SOIXAN7E QUIN5E"", ""id"": 23271}, {""name"": ""See Me Louisiana"", ""id"": 23272}]","[{""iso_3166_1"": ""US"", ""name"": ""United States of America""}, {""iso_3166_1"": ""FR"", ""name"": ""France""}]",2013-05-29,117698894,115.0,"[{""iso_639_1"": ""fr"", ""name"": ""Fran\u00e7ais""}, {""iso_639_1"": ""en"", ""name"": ""English""}]",Released,4 amazing magicians. 3 impossible heists. 1 billion dollars. This is no illusion.,Now You See Me,7.3,5487
60000000,"[{""id"": 35, ""name"": ""Comedy""}, {""id"": 18, ""name"": ""Drama""}]",http://www.theterminal-themovie.com/,594,"[{""id"": 242, ""name"": ""new york""}, {""id"": 822, ""name"": ""airport""}, {""id"": 1459, ""name"": ""marriage proposal""}, {""id"": 1638, ""name"": ""translation""}, {""id"": 1846, ""name"": ""craftsman""}, {""id"": 2080, ""name"": ""stewardess""}, {""id"": 2173, ""name"": ""illegal immigration""}, {""id"": 2568, ""name"": ""language barrier""}, {""id"": 3013, ""name"": ""jfk international airport""}, {""id"": 3014, ""name"": ""immigration law""}, {""id"": 3015, ""name"": ""fast food restaurant""}, {""id"": 3016, ""name"": ""security camera""}, {""id"": 3017, ""name"": ""jazz musician""}, {""id"": 3018, ""name"": ""saxophonist""}, {""id"": 3019, ""name"": ""autograph""}, {""id"": 3022, ""name"": ""passport""}, {""id"": 3023, ""name"": ""eastern europe""}, {""id"": 6054, ""name"": ""friendship""}]",en,The Terminal,"Viktor Navorski is a man without a country; his plane took off just as a coup d'etat exploded in his homeland, leaving it in shambles, and now he's stranded at Kennedy Airport, where he's holding a passport that nobody recognizes. While quarantined in the transit lounge until authorities can figure out what to do with him, Viktor simply goes on living – and courts romance with a beautiful flight attendant.",57.753914,"[{""name"": ""DreamWorks SKG"", ""id"": 27}, {""name"": ""Amblin Entertainment"", ""id"": 56}, {""name"": ""Parkes/MacDonald Productions"", ""id"": 11084}]","[{""iso_3166_1"": ""US"", ""name"": ""United States of America""}]",2004-06-17,219417255,128.0,"[{""iso_639_1"": ""bg"", ""name"": ""\u0431\u044a\u043b\u0433\u0430\u0440\u0441\u043a\u0438 \u0435\u0437\u0438\u043a""}, {""iso_639_1"": ""en"", ""name"": ""English""}, {""iso_639_1"": ""fr"", ""name"": ""Fran\u00e7ais""}, {""iso_639_1"": ""ru"", ""name"": ""P\u0443\u0441\u0441\u043a\u0438\u0439""}, {""iso_639_1"": ""es"", ""name"": ""Espa\u00f1ol""}]",Released,Life is waiting.,The Terminal,7.0,1910
75000000,"[{""id"": 35, ""name"": ""Comedy""}, {""id"": 28, ""name"": ""Action""}, {""id"": 12, ""name"": ""Adventure""}]",,203801,"[{""id"": 470, ""name"": ""spy""}, {""id"": 2106, ""name"": ""cold war""}, {""id"": 9714, ""name"": ""remake""}, {""id"": 10988, ""name"": ""based on tv series""}, {""id"": 167316, ""name"": ""buddy cop""}, {""id"": 190654, ""name"": ""russian spy""}, {""id"": 197822, ""name"": ""american spy""}]",en,The Man from U.N.C.L.E.,"At the height of the Cold War, a mysterious criminal organization plans to use nuclear weapons and technology to upset the fragile balance of power between the United States and Soviet Union. CIA agent Napoleon Solo and KGB agent Illya Kuryakin are forced to put aside their hostilities and work together to stop the evildoers in their tracks. The duo's only lead is the daughter of a missing German scientist, whom they must find soon to prevent a global catastrophe.",48.744209,"[{""name"": ""Davis Entertainment"", ""id"": 1302}, {""name"": ""Warner Bros."", ""id"": 6194}, {""name"": ""Wigram Productions"", ""id"": 23202}, {""name"": ""RatPac-Dune Entertainment"", ""id"": 41624}]","[{""iso_3166_1"": ""US"", ""name"": ""United States of America""}]",2015-08-13,108145109,116.0,"[{""iso_639_1"": ""it"", ""name"": ""Italiano""}, {""iso_639_1"": ""en"", ""name"": ""English""}, {""iso_639_1"": ""ru"", ""name"": ""P\u0443\u0441\u0441\u043a\u0438\u0439""}, {""iso_639_1"": ""de"", ""name"": ""Deutsch""}]",Released,Saving the world never goes out of style.,The Man from U.N.C.L.E.,7.1,2265
72000000,"[{""id"": 28, ""name"": ""Action""}, {""id"": 18, ""name"": ""Drama""}, {""id"": 36, ""name"": ""History""}, {""id"": 10752, ""name"": ""War""}]",,197,"[{""id"": 30, ""name"": ""individual""}, {""id"": 388, ""name"": ""scotland""}, {""id"": 930, ""name"": ""in love with enemy""}, {""id"": 3754, ""name"": ""legend""}, {""id"": 4097, ""name"": ""independence""}, {""id"": 6987, ""name"": ""idealism""}, {""id"": 162845, ""name"": ""revolt""}, {""id"": 189433, ""name"": ""tyranny""}]",en,Braveheart,"Enraged at the slaughter of Murron, his new bride and childhood love, Scottish warrior William Wallace slays a platoon of the local English lord's soldiers. This leads the village to revolt and, eventually, the entire country to rise up against English rule.",60.722162,"[{""name"": ""Icon Entertainment International"", ""id"": 4564}, {""name"": ""The Ladd Company"", ""id"": 7965}, {""name"": ""B.H. Finance C.V."", ""id"": 11353}]","[{""iso_3166_1"": ""US"", ""name"": ""United States of America""}]",1995-05-24,210000000,177.0,"[{""iso_639_1"": ""en"", ""name"": ""English""}, {""iso_639_1"": ""fr"", ""name"": ""Fran\u00e7ais""}, {""iso_639_1"": ""la"", ""name"": ""Latin""}, {""iso_639_1"": ""gd"", ""name"": """"}]",Released,Every man dies. Not every man truly lives.,Braveheart,7.7,3336
70000000,"[{""id"": 18, ""name"": ""Drama""}, {""id"": 28, ""name"": ""Action""}, {""id"": 53, ""name"": ""Thriller""}, {""id"": 10752, ""name"": ""War""}]",http://www.inglouriousbasterds-movie.com/,16869,"[{""id"": 90, ""name"": ""paris""}, {""id"": 1008, ""name"": ""guerrilla""}, {""id"": 1388, ""name"": ""cinema""}, {""id"": 1430, ""name"": ""self sacrifice""}, {""id"": 1560, ""name"": ""dynamite""}, {""id"": 1666, ""name"": ""mexican standoff""}, {""id"": 1956, ""name"": ""world war ii""}, {""id"": 2433, ""name"": ""jew persecution""}, {""id"": 2606, ""name"": ""jew""}, {""id"": 2652, ""name"": ""nazis""}, {""id"": 3260, ""name"": ""masochism""}, {""id"": 4426, ""name"": ""sadism""}, {""id"": 5470, ""name"": ""scalp""}, {""id"": 6538, ""name"": ""winston churchill""}, {""id"": 9851, ""name"": ""knife in hand""}, {""id"": 10144, ""name"": ""anti semitism""}, {""id"": 10292, ""name"": ""gore""}, {""id"": 11105, ""name"": ""swastika""}, {""id"": 11249, ""name"": ""blood bath""}, {""id"": 13519, ""name"": ""german occupation of france""}, {""id"": 14819, ""name"": ""violence""}, {""id"": 163656, ""name"": ""gun violence""}]",en,Inglourious Basterds,"In Nazi-occupied France during World War II, a group of Jewish-American soldiers known as ""The Basterds"" are chosen specifically to spread fear throughout the Third Reich by scalping and brutally killing Nazis. The Basterds, lead by Lt. Aldo Raine soon cross paths with a French-Jewish teenage girl who runs a movie theater in Paris which is targeted by the soldiers.",72.595961,"[{""name"": ""Universal Pictures"", ""id"": 33}, {""name"": ""A Band Apart"", ""id"": 59}, {""name"": ""The Weinstein Company"", ""id"": 308}, {""name"": ""Zehnte Babelsberg"", ""id"": 6817}, {""name"": ""Visiona Romantica"", ""id"": 6818}]","[{""iso_3166_1"": ""DE"", ""name"": ""Germany""}, {""iso_3166_1"": ""US"", ""name"": ""United States of America""}]",2009-08-18,319131050,153.0,"[{""iso_639_1"": ""de"", ""name"": ""Deutsch""}, {""iso_639_1"": ""en"", ""name"": ""English""}, {""iso_639_1"": ""fr"", ""name"": ""Fran\u00e7ais""}, {""iso_639_1"": ""it"", ""name"": ""Italiano""}]",Released,Once upon a time in Nazi occupied France...,Inglourious Basterds,7.9,6430
70000000,"[{""id"": 12, ""name"": ""Adventure""}, {""id"": 14, ""name"": ""Fantasy""}, {""id"": 18, ""name"": ""Drama""}]",,587,"[{""id"": 291, ""name"": ""circus""}, {""id"": 494, ""name"": ""father son relationship""}, {""id"": 616, ""name"": ""witch""}, {""id"": 1357, ""name"": ""fish""}, {""id"": 1495, ""name"": ""fishing""}, {""id"": 2038, ""name"": ""love of one's life""}, {""id"": 2517, ""name"": ""leech""}, {""id"": 3206, ""name"": ""story teller""}, {""id"": 4073, ""name"": ""apoplectic stroke""}, {""id"": 4120, ""name"": ""fair""}, {""id"": 5938, ""name"": ""mermaid""}, {""id"": 10163, ""name"": ""cancer""}, {""id"": 14534, ""name"": ""relationship""}, {""id"": 14751, ""name"": ""youth""}, {""id"": 156192, ""name"": ""gentle giant""}]",en,Big Fish,"Throughout his life Edward Bloom has always been a man of big appetites, enormous passions and tall tales. In his later years, he remains a huge mystery to his son, William. Now, to get to know the real man, Will begins piecing together a true picture of his father from flashbacks of his amazing adventures.",46.199482,"[{""name"": ""Columbia Pictures"", ""id"": 5}, {""name"": ""The Zanuck Company"", ""id"": 80}, {""name"": ""Jinks/Cohen Company"", ""id"": 2721}, {""name"": ""Tim Burton Productions"", ""id"": 8601}]","[{""iso_3166_1"": ""US"", ""name"": ""United States of America""}]",2003-12-25,122919055,125.0,"[{""iso_639_1"": ""en"", ""name"": ""English""}]",Released,An adventure as big as life itself.,Big Fish,7.6,1994
70000000,"[{""id"": 12, ""name"": ""Adventure""}, {""id"": 14, ""name"": ""Fantasy""}, {""id"": 10749, ""name"": ""Romance""}, {""id"": 10751, ""name"": ""Family""}]",http://www.stardustmovie.com,2270,"[{""id"": 616, ""name"": ""witch""}, {""id"": 818, ""name"": ""based on novel""}, {""id"": 1605, ""name"": ""new love""}, {""id"": 3071, ""name"": ""prince""}, {""id"": 3258, ""name"": ""beauty""}, {""id"": 3412, ""name"": ""star""}, {""id"": 4152, ""name"": ""kingdom""}, {""id"": 4372, ""name"": ""wall""}, {""id"": 6998, ""name"": ""falling star""}, {""id"": 9920, ""name"": ""royalty""}, {""id"": 10048, ""name"": ""unrequited love""}, {""id"": 10842, ""name"": ""good vs evil""}, {""id"": 170771, ""name"": ""fratricide""}]",en,Stardust,"In a countryside town bordering on a magical land, a young man makes a promise to his beloved that he'll retrieve a fallen star by venturing into the magical realm. His journey takes him into a world beyond his wildest dreams and reveals his true identity.",48.032734,"[{""name"": ""Paramount Pictures"", ""id"": 4}, {""name"": ""Ingenious Film Partners"", ""id"": 289}, {""name"": ""Di Bonaventura Pictures"", ""id"": 435}, {""name"": ""Marv Films"", ""id"": 5374}, {""name"": ""Vaughn Productions"", ""id"": 23420}]","[{""iso_3166_1"": ""IS"", ""name"": ""Iceland""}, {""iso_3166_1"": ""GB"", ""name"": ""United Kingdom""}, {""iso_3166_1"": ""US"", ""name"": ""United States of America""}]",2007-08-09,135560026,127.0,"[{""iso_639_1"": ""en"", ""name"": ""English""}]",Released,This Summer A Star Falls. The Chase Begins.,Stardust,7.1,1184
