budget,genres,homepage,id,keywords,original_language,original_title,overview,popularity,production_companies,production_countries,release_date,revenue,runtime,spoken_languages,status,tagline,title,vote_average,vote_count
20000000,"[{""id"": 35, ""name"": ""Comedy""}]",http://www.areyousuperbad.com/,8363,"[{""id"": 1412, ""name"": ""becoming an adult""}, {""id"": 6270, ""name"": ""high school""}, {""id"": 6517, ""name"": ""young people""}, {""id"": 162914, ""name"": ""one night""}]",en,Superbad,"High school best buddies are facing separation anxiety as they prepare to go off to college. While attempting to score alcohol for a party with help from a fake ID-toting friend, the guys' evening takes a turn into chaotic territory.",33.436092,"[{""name"": ""Columbia Pictures"", ""id"": 5}, {""name"": ""Apatow Productions"", ""id"": 10105}]","[{""iso_3166_1"": ""US"", ""name"": ""United States of America""}]",2007-08-17,121463226,113.0,"[{""iso_639_1"": ""en"", ""name"": ""English""}]",Released,Come and Get Some!,Superbad,7.0,2100
0,"[{""id"": 27, ""name"": ""Horror""}, {""id"": 18, ""name"": ""Drama""}, {""id"": 9648, ""name"": ""Mystery""}, {""id"": 53, ""name"": ""Thriller""}]",,1933,"[{""id"": 2341, ""name"": ""nanny""}, {""id"": 3358, ""name"": ""haunted house""}, {""id"": 5911, ""name"": ""channel islands""}, {""id"": 33465, ""name"": ""parallel world""}, {""id"": 166591, ""name"": ""photosensitivity""}, {""id"": 210530, ""name"": ""spiritism""}]",en,The Others,"Grace is a religious woman who lives in an old house kept dark because her two children, Anne and Nicholas, have a rare sensitivity to light. When the family begins to suspect the house is haunted, Grace fights to protect her children at any cost in the face of strange events and disturbing visions.",25.881355,"[{""name"": ""Cruise/Wagner Productions"", ""id"": 44}, {""name"": ""Canal Plus"", ""id"": 104}, {""name"": ""Sogecine"", ""id"": 692}, {""name"": ""Las Producciones del Escorpion"", ""id"": 778}, {""name"": ""Lucky Red"", ""id"": 779}, {""name"": ""Dimension Films"", ""id"": 7405}, {""name"": ""Miramax"", ""id"": 53009}]","[{""iso_3166_1"": ""ES"", ""name"": ""Spain""}, {""iso_3166_1"": ""US"", ""name"": ""United States of America""}, {""iso_3166_1"": ""FR"", ""name"": ""France""}, {""iso_3166_1"": ""IT"", ""name"": ""Italy""}]",2001-08-02,0,101.0,"[{""iso_639_1"": ""fr"", ""name"": ""Fran\u00e7ais""}, {""iso_639_1"": ""en"", ""name"": ""English""}]",Released,"Sooner or later she'll see them, then everything will be different.",The Others,7.4,1660
18500000,"[{""id"": 27, ""name"": ""Horror""}, {""id"": 28, ""name"": ""Action""}, {""id"": 53, ""name"": ""Thriller""}, {""id"": 878, ""name"": ""Science Fiction""}]",,679,"[{""id"": 803, ""name"": ""android""}, {""id"": 1603, ""name"": ""extraterrestrial technology""}, {""id"": 1826, ""name"": ""space marine""}, {""id"": 2345, ""name"": ""spaceman""}, {""id"": 3385, ""name"": ""cryogenics""}, {""id"": 3387, ""name"": ""vacuum""}, {""id"": 3388, ""name"": ""space colony""}, {""id"": 3389, ""name"": ""warrior woman""}, {""id"": 3591, ""name"": ""settler""}, {""id"": 3801, ""name"": ""space travel""}, {""id"": 4090, ""name"": ""colony""}, {""id"": 9951, ""name"": ""alien""}, {""id"": 226177, ""name"": ""xenomorph""}]",en,Aliens,"When Ripley's lifepod is found by a salvage crew over 50 years later, she finds that terra-formers are on the very planet they found the alien species. When the company sends a family of colonists out to investigate her story, all contact is lost with the planet and colonists. They enlist Ripley and the colonial marines to return and search for answers.",67.66094,"[{""name"": ""Twentieth Century Fox Film Corporation"", ""id"": 306}, {""name"": ""SLM Production Group"", ""id"": 396}, {""name"": ""Brandywine Productions"", ""id"": 19747}]","[{""iso_3166_1"": ""GB"", ""name"": ""United Kingdom""}, {""iso_3166_1"": ""US"", ""name"": ""United States of America""}]",1986-07-18,183316455,137.0,"[{""iso_639_1"": ""en"", ""name"": ""English""}]",Released,This Time It's War,Aliens,7.7,3220
300000,"[{""id"": 27, ""name"": ""Horror""}, {""id"": 53, ""name"": ""Thriller""}]",http://www.theofficialjohncarpenter.com/halloween/,948,"[{""id"": 293, ""name"": ""female nudity""}, {""id"": 2483, ""name"": ""nudity""}, {""id"": 2546, ""name"": ""mask""}, {""id"": 2604, ""name"": ""babysitter""}, {""id"": 3335, ""name"": ""halloween""}, {""id"": 6149, ""name"": ""police""}, {""id"": 10024, ""name"": ""psychopathic killer""}, {""id"": 10183, ""name"": ""independent film""}, {""id"": 10333, ""name"": ""stalking""}, {""id"": 10714, ""name"": ""serial killer""}, {""id"": 10776, ""name"": ""marijuana""}, {""id"": 11040, ""name"": ""masked killer""}, {""id"": 11221, ""name"": ""blood""}, {""id"": 11488, ""name"": ""pot smoking""}, {""id"": 12339, ""name"": ""slasher""}, {""id"": 13112, ""name"": ""murderer""}, {""id"": 14698, ""name"": ""throat slitting""}, {""id"": 14805, ""name"": ""maniac""}, {""id"": 14819, ""name"": ""violence""}, {""id"": 17987, ""name"": ""killing spree""}, {""id"": 18035, ""name"": ""family""}, {""id"": 34117, ""name"": ""cult film""}, {""id"": 156075, ""name"": ""evil""}, {""id"": 157701, ""name"": ""psychotic""}, {""id"": 174424, ""name"": ""smoking pot""}, {""id"": 198914, ""name"": ""institution""}, {""id"": 207159, ""name"": ""escaped killer""}]",en,Halloween,"In John Carpenter's horror classic, a psychotic murderer, institutionalized since childhood for the murder of his sister, escapes and stalks a bookish teenage girl and her friends while his doctor chases him through the streets.",30.301307,"[{""name"": ""Compass International Pictures"", ""id"": 14323}, {""name"": ""Falcon International Productions"", ""id"": 22814}]","[{""iso_3166_1"": ""US"", ""name"": ""United States of America""}]",1978-10-25,70000000,91.0,"[{""iso_639_1"": ""en"", ""name"": ""English""}]",Released,The Night He Came Home,Halloween,7.4,1035
17000000,"[{""id"": 35, ""name"": ""Comedy""}, {""id"": 10402, ""name"": ""Music""}, {""id"": 10749, ""name"": ""Romance""}]",http://www.pitchperfectmovie.com/,114150,"[{""id"": 271, ""name"": ""competition""}, {""id"": 1253, ""name"": ""roommate""}, {""id"": 3616, ""name"": ""college""}, {""id"": 5248, ""name"": ""female friendship""}, {""id"": 6027, ""name"": ""music""}, {""id"": 10079, ""name"": ""hazing""}, {""id"": 10556, ""name"": ""male female relationship""}, {""id"": 33928, ""name"": ""audition""}, {""id"": 155939, ""name"": ""group of friends""}, {""id"": 167768, ""name"": ""dorm room""}, {""id"": 177972, ""name"": ""bickering""}, {""id"": 186117, ""name"": ""dj""}, {""id"": 186120, ""name"": ""singing competition""}, {""id"": 186125, ""name"": ""film score""}, {""id"": 186136, ""name"": ""female musician""}, {""id"": 186147, ""name"": ""singing contest""}, {""id"": 206298, ""name"": ""young adult""}, {""id"": 209838, ""name"": ""acapella""}]",en,Pitch Perfect,"College student Beca knows she does not want to be part of a clique, but that's exactly where she finds herself after arriving at her new school. Thrust in among mean gals, nice gals and just plain weird gals, Beca finds that the only thing they have in common is how well they sing together. She takes the women of the group out of their comfort zone of traditional arrangements and into a world of amazing harmonic combinations in a fight to the top of college music competitions.",32.746486,"[{""name"": ""Brownstone Productions"", ""id"": 12365}]","[{""iso_3166_1"": ""US"", ""name"": ""United States of America""}]",2012-09-28,115350426,112.0,"[{""iso_639_1"": ""en"", ""name"": ""English""}]",Released,Get pitch slapped.,Pitch Perfect,7.3,2247
40000000,"[{""id"": 14, ""name"": ""Fantasy""}, {""id"": 18, ""name"": ""Drama""}, {""id"": 53, ""name"": ""Thriller""}, {""id"": 10749, ""name"": ""Romance""}]",,1491,"[{""id"": 2343, ""name"": ""magic""}, {""id"": 7376, ""name"": ""princess""}, {""id"": 9673, ""name"": ""love""}, {""id"": 9823, ""name"": ""rivalry""}, {""id"": 18267, ""name"": ""vienna austria""}, {""id"": 169456, ""name"": ""crown prince""}, {""id"": 176857, ""name"": ""duchess""}, {""id"": 188989, ""name"": ""supernatural power""}, {""id"": 209157, ""name"": ""childhood sweetheart""}, {""id"": 233055, ""name"": ""vienna""}]",en,The Illusionist,"With his eye on a lovely aristocrat, a gifted illusionist named Eisenheim uses his powers to win her away from her betrothed, a crowned prince. But Eisenheim's scheme creates tumult within the monarchy and ignites the suspicion of a dogged inspector.",36.960953,"[{""name"": ""Michael London Productions"", ""id"": 1187}, {""name"": ""Stillking Films"", ""id"": 11345}, {""name"": ""Bob Yari Productions"", ""id"": 12260}, {""name"": ""Bull's Eye Entertainment"", ""id"": 25432}, {""name"": ""Contagious Entertainment"", ""id"": 52740}, {""name"": ""Revolution Sun Studios"", ""id"": 76043}]","[{""iso_3166_1"": ""CZ"", ""name"": ""Czech Republic""}, {""iso_3166_1"": ""US"", ""name"": ""United States of America""}]",2006-08-18,86915017,110.0,"[{""iso_639_1"": ""en"", ""name"": ""English""}]",Released,Nothing Is What It Seems.,The Illusionist,7.1,1615
16400000,"[{""id"": 18, ""name"": ""Drama""}]",,207,"[{""id"": 30, ""name"": ""individual""}, {""id"": 490, ""name"": ""philosophy""}, {""id"": 496, ""name"": ""poetry""}, {""id"": 497, ""name"": ""shakespeare""}, {""id"": 1992, ""name"": ""professor""}, {""id"": 2132, ""name"": ""literature""}, {""id"": 6054, ""name"": ""friendship""}, {""id"": 226128, ""name"": ""filmes focados em um professor""}]",en,Dead Poets Society,"At an elite, old-fashioned boarding school in New England, a passionate English teacher inspires his students to rebel against convention and seize the potential of every day, courting the disdain of the stern headmaster.",55.458584,"[{""name"": ""Touchstone Pictures"", ""id"": 9195}, {""name"": ""Silver Screen Partners IV"", ""id"": 10282}]","[{""iso_3166_1"": ""US"", ""name"": ""United States of America""}]",1989-06-02,235860116,129.0,"[{""iso_639_1"": ""en"", ""name"": ""English""}]",Released,He was their inspiration. He made their lives extraordinary.,Dead Poets Society,8.1,2705
15000000,"[{""id"": 18, ""name"": ""Drama""}, {""id"": 35, ""name"": ""Comedy""}, {""id"": 10749, ""name"": ""Romance""}]",http://www.warnerbros.fr/the-artist,74643,"[{""id"": 887, ""name"": ""film producer""}, {""id"": 6966, ""name"": ""film history""}, {""id"": 10732, ""name"": ""movie studio""}, {""id"": 12396, ""name"": ""hollywood""}, {""id"": 15162, ""name"": ""dog""}, {""id"": 41390, ""name"": ""mustache""}, {""id"": 154800, ""name"": ""hollywoodland""}, {""id"": 154802, ""name"": ""silent film""}, {""id"": 154806, ""name"": ""marquee""}, {""id"": 158225, ""name"": ""terrier""}, {""id"": 162262, ""name"": ""movie star""}, {""id"": 164641, ""name"": ""flapper""}, {""id"": 188647, ""name"": ""silent film star""}]",en,The Artist,"Hollywood, 1927: As silent movie star George Valentin wonders if the arrival of talking pictures will cause him to fade into oblivion, he sparks with Peppy Miller, a young dancer set for a big break.",29.943316,"[{""name"": ""France 3 Cin\u00e9ma"", ""id"": 591}, {""name"": ""La Petite Reine"", ""id"": 1992}, {""name"": ""Studio 37"", ""id"": 2577}, {""name"": ""uFilm"", ""id"": 8676}, {""name"": ""Jouror Productions"", ""id"": 12391}, {""name"": ""La Classe Am\u00e9ricaine"", ""id"": 50630}, {""name"": ""JD Prod"", ""id"": 71510}]","[{""iso_3166_1"": ""BE"", ""name"": ""Belgium""}, {""iso_3166_1"": ""FR"", ""name"": ""France""}]",2011-05-15,133432856,100.0,"[{""iso_639_1"": ""fr"", ""name"": ""Fran\u00e7ais""}]",Released,A Breath Of Fresh Vintage Air,The Artist,7.3,1049
16000000,"[{""id"": 35, ""name"": ""Comedy""}, {""id"": 18, ""name"": ""Drama""}, {""id"": 10749, ""name"": ""Romance""}]",http://www.moonrisekingdom.com,83666,"[{""id"": 41393, ""name"": ""new england""}, {""id"": 157303, ""name"": ""first love""}, {""id"": 159869, ""name"": ""eye patch""}, {""id"": 169962, ""name"": ""search party""}, {""id"": 169964, ""name"": ""devastation""}, {""id"": 169965, ""name"": ""pen pal""}, {""id"": 169967, ""name"": ""handkerchief""}, {""id"": 169970, ""name"": ""child smoking""}, {""id"": 169977, ""name"": ""small town sheriff""}, {""id"": 169978, ""name"": ""the color red""}, {""id"": 169981, ""name"": ""the color blue""}, {""id"": 169990, ""name"": ""boy scouts""}, {""id"": 169991, ""name"": ""sand dancing""}, {""id"": 169993, ""name"": ""meet cute""}, {""id"": 169995, ""name"": ""boy scouts leader""}, {""id"": 174316, ""name"": ""pipe smoking""}, {""id"": 179431, ""name"": ""duringcreditsstinger""}]",en,Moonrise Kingdom,"Set on an island off the coast of New England in the summer of 1965, Moonrise Kingdom tells the story of two twelve-year-olds who fall in love, make a secret pact, and run away together into the wilderness. As various authorities try to hunt them down, a violent storm is brewing off-shore – and the peaceful island community is turned upside down in more ways than anyone can handle.",41.083914,"[{""name"": ""Scott Rudin Productions"", ""id"": 258}, {""name"": ""Indian Paintbrush"", ""id"": 9350}, {""name"": ""Focus Features"", ""id"": 10146}, {""name"": ""American Empirical Pictures"", ""id"": 23449}, {""name"": ""Moonrise"", ""id"": 25626}]","[{""iso_3166_1"": ""US"", ""name"": ""United States of America""}]",2012-05-16,68263166,94.0,"[{""iso_639_1"": ""en"", ""name"": ""English""}]",Released,A tormenting and surprising story of children and adults during the stormy days of the summer of 1965.,Moonrise Kingdom,7.6,1662
19000000,"[{""id"": 14, ""name"": ""Fantasy""}, {""id"": 18, ""name"": ""Drama""}, {""id"": 10752, ""name"": ""War""}]",http://www.panslabyrinth.com,1417,"[{""id"": 514, ""name"": ""spain""}, {""id"": 836, ""name"": ""resistance""}, {""id"": 964, ""name"": ""servant""}, {""id"": 2095, ""name"": ""anti hero""}, {""id"": 2710, ""name"": ""fairy""}, {""id"": 3205, ""name"": ""fairy tale""}, {""id"": 5882, ""name"": ""franco regime""}, {""id"": 6092, ""name"": ""army""}, {""id"": 7376, ""name"": ""princess""}, {""id"": 9673, ""name"": ""love""}, {""id"": 9720, ""name"": ""woods""}, {""id"": 13084, ""name"": ""king""}, {""id"": 18028, ""name"": ""hiding""}, {""id"": 18129, ""name"": ""labyrinth""}, {""id"": 207003, ""name"": ""mythological""}]",es,El laberinto del fauno,"Living with her tyrannical stepfather in a new home with her pregnant mother, 10-year-old Ofelia feels alone until she explores a decaying labyrinth guarded by a mysterious faun who claims to know her destiny. If she wishes to return to her real father, Ofelia must complete three terrifying tasks.",90.809408,"[{""name"": ""Estudios Picasso"", ""id"": 2029}, {""name"": ""Esperanto Filmoj"", ""id"": 7470}, {""name"": ""Tequila Gang"", ""id"": 11628}]","[{""iso_3166_1"": ""ES"", ""name"": ""Spain""}, {""iso_3166_1"": ""US"", ""name"": ""United States of America""}, {""iso_3166_1"": ""MX"", ""name"": ""Mexico""}]",2006-05-27,83258226,118.0,"[{""iso_639_1"": ""es"", ""name"": ""Espa\u00f1ol""}]",Released,What happens when make-believe believes it's real?,Pan's Labyrinth,7.6,3041
12000000,"[{""id"": 80, ""name"": ""Crime""}, {""id"": 28, ""name"": ""Action""}, {""id"": 35, ""name"": ""Comedy""}]",http://www.universalstudiosentertainment.com/hot-fuzz/,4638,"[{""id"": 5331, ""name"": ""village""}, {""id"": 5638, ""name"": ""arrest""}, {""id"": 6149, ""name"": ""police""}, {""id"": 9104, ""name"": ""partner""}, {""id"": 9826, ""name"": ""murder""}, {""id"": 10410, ""name"": ""conspiracy""}, {""id"": 12371, ""name"": ""gunfight""}, {""id"": 167268, ""name"": ""police force""}, {""id"": 167284, ""name"": ""cowboy costume""}, {""id"": 207819, ""name"": ""accident""}]",en,Hot Fuzz,"Top London cop, PC Nicholas Angel is good. Too good.  To stop the rest of his team from looking bad, he is reassigned to the quiet town of Sandford, paired with simple country cop, and everything seems quiet until two actors are found decapitated. It is addressed as an accident, but Angel isn't going to accept that, especially when more and more people turn up dead.",38.623178,"[{""name"": ""Universal Pictures"", ""id"": 33}, {""name"": ""Big Talk Productions"", ""id"": 443}, {""name"": ""StudioCanal"", ""id"": 694}, {""name"": ""GAGA"", ""id"": 3656}, {""name"": ""Working Title Films"", ""id"": 10163}]","[{""iso_3166_1"": ""GB"", ""name"": ""United Kingdom""}]",2007-02-14,80573774,121.0,"[{""iso_639_1"": ""en"", ""name"": ""English""}]",Released,Big cops. Small town. Moderate violence.,Hot Fuzz,7.4,2199
16000000,"[{""id"": 18, ""name"": ""Drama""}, {""id"": 10751, ""name"": ""Family""}]",,28178,"[{""id"": 907, ""name"": ""japanese""}, {""id"": 1797, ""name"": ""loyalty""}, {""id"": 2526, ""name"": ""human animal relationship""}, {""id"": 6054, ""name"": ""friendship""}, {""id"": 9713, ""name"": ""friends""}, {""id"": 10235, ""name"": ""family relationships""}, {""id"": 15162, ""name"": ""dog""}, {""id"": 163098, ""name"": ""newspaper reporter""}, {""id"": 192555, ""name"": ""family dog""}, {""id"": 206863, ""name"": ""waiting""}]",en,Hachi: A Dog's Tale,A drama based on the true story of a college professor's bond with the abandoned dog he takes into his home.,43.217089,"[{""name"": ""Grand Army Entertainment"", ""id"": 1843}, {""name"": ""Scion Films"", ""id"": 7419}, {""name"": ""Inferno Distribution"", ""id"": 11278}, {""name"": ""Stage 6 Films"", ""id"": 11341}, {""name"": ""Hachiko"", ""id"": 66327}, {""name"": ""Opperman Viner Chrystyn Entertainment"", ""id"": 66328}]","[{""iso_3166_1"": ""GB"", ""name"": ""United Kingdom""}, {""iso_3166_1"": ""US"", ""name"": ""United States of America""}]",2009-06-13,47801389,93.0,"[{""iso_639_1"": ""en"", ""name"": ""English""}, {""iso_639_1"": ""ja"", ""name"": ""\u65e5\u672c\u8a9e""}]",Released,"A true story of faith, devotion and undying love.",Hachi: A Dog's Tale,7.7,1717
18000000,"[{""id"": 35, ""name"": ""Comedy""}, {""id"": 10751, ""name"": ""Family""}]",https://www.foxconnect.com/home-alone-4.html,771,"[{""id"": 65, ""name"": ""holiday""}, {""id"": 1437, ""name"": ""burglar""}, {""id"": 14903, ""name"": ""home invasion""}, {""id"": 15075, ""name"": ""mischief""}, {""id"": 163841, ""name"": ""booby trap""}, {""id"": 169826, ""name"": ""home alone""}, {""id"": 169829, ""name"": ""suburban chicago""}, {""id"": 169850, ""name"": ""mischievous child""}, {""id"": 207317, ""name"": ""christmas""}, {""id"": 208349, ""name"": ""child""}]",en,Home Alone,"Eight-year-old Kevin McCallister makes the most of the situation after his family unwittingly leaves him behind when they go on Christmas vacation. But when a pair of bungling burglars set their sights on Kevin's house, the plucky kid stands ready to defend his territory. By planting booby traps galore, adorably mischievous Kevin stands his ground as his frantic mother attempts to race home before.",2.186927,"[{""name"": ""Twentieth Century Fox Film Corporation"", ""id"": 306}, {""name"": ""Hughes Entertainment"", ""id"": 477}]","[{""iso_3166_1"": ""US"", ""name"": ""United States of America""}]",1990-11-09,476684675,103.0,"[{""iso_639_1"": ""en"", ""name"": ""English""}]",Released,A Family Comedy Without the Family.,Home Alone,7.1,2414
15000000,"[{""id"": 18, ""name"": ""Drama""}]",http://www.dreamworks.com/ab/,14,"[{""id"": 255, ""name"": ""male nudity""}, {""id"": 293, ""name"": ""female nudity""}, {""id"": 596, ""name"": ""adultery""}, {""id"": 1599, ""name"": ""midlife crisis""}, {""id"": 1862, ""name"": ""coming out""}, {""id"": 2201, ""name"": ""first time""}, {""id"": 2249, ""name"": ""camcorder""}, {""id"": 2389, ""name"": ""virgin""}, {""id"": 2483, ""name"": ""nudity""}, {""id"": 2559, ""name"": ""film maker""}, {""id"": 2918, ""name"": ""estate agent""}, {""id"": 8201, ""name"": ""satire""}, {""id"": 9957, ""name"": ""loneliness""}, {""id"": 10123, ""name"": ""dark comedy""}, {""id"": 10532, ""name"": ""suburbia""}, {""id"": 10683, ""name"": ""coming of age""}, {""id"": 10776, ""name"": ""marijuana""}, {""id"": 33611, ""name"": ""exercise""}, {""id"": 166123, ""name"": ""parent child relationship""}, {""id"": 224279, ""name"": ""bittersweet""}, {""id"": 229299, ""name"": ""affair""}]",en,American Beauty,"Lester Burnham, a depressed suburban father in a mid-life crisis, decides to turn his hectic life around after developing an infatuation with his daughter's attractive friend.",80.878605,"[{""name"": ""DreamWorks SKG"", ""id"": 27}, {""name"": ""Jinks/Cohen Company"", ""id"": 2721}]","[{""iso_3166_1"": ""US"", ""name"": ""United States of America""}]",1999-09-15,356296601,122.0,"[{""iso_639_1"": ""en"", ""name"": ""English""}]",Released,Look closer.,American Beauty,7.9,3313
15000000,"[{""id"": 18, ""name"": ""Drama""}, {""id"": 36, ""name"": ""History""}]",http://www.kingsspeech.com/,45269,"[{""id"": 1025, ""name"": ""great britain""}, {""id"": 2135, ""name"": ""radio""}, {""id"": 2471, ""name"": ""monarchy""}, {""id"": 4305, ""name"": ""radio transmission""}, {""id"": 4833, ""name"": ""royal family""}, {""id"": 6001, ""name"": ""speech""}, {""id"": 6038, ""name"": ""marriage""}, {""id"": 9920, ""name"": ""royalty""}, {""id"": 10201, ""name"": ""death of father""}]",en,The King's Speech,"The King's Speech tells the story of the man who became King George VI, the father of Queen Elizabeth II. After his brother abdicates, George ('Bertie') reluctantly assumes the throne. Plagued by a dreaded stutter and considered unfit to be king, Bertie engages the help of an unorthodox speech therapist named Lionel Logue. Through a set of unexpected techniques, and as a result of an unlikely friendship, Bertie is able to find his voice and boldly lead the country into war.",54.053576,"[{""name"": ""The Weinstein Company"", ""id"": 308}, {""name"": ""UK Film Council"", ""id"": 2452}, {""name"": ""Bedlam Productions"", ""id"": 5005}, {""name"": ""See-Saw Films"", ""id"": 7217}, {""name"": ""Aegis Film Fund"", ""id"": 7309}, {""name"": ""FilmNation Entertainment"", ""id"": 7493}, {""name"": ""Momentum Pictures"", ""id"": 19578}, {""name"": ""Molinare Investment"", ""id"": 19579}]","[{""iso_3166_1"": ""GB"", ""name"": ""United Kingdom""}]",2010-09-06,414211549,118.0,"[{""iso_639_1"": ""en"", ""name"": ""English""}]",Released,Find your voice.,The King's Speech,7.6,2752
14000000,"[{""id"": 36, ""name"": ""History""}, {""id"": 18, ""name"": ""Drama""}, {""id"": 53, ""name"": ""Thriller""}, {""id"": 10752, ""name"": ""War""}]",http://theimitationgamemovie.com/,205596,"[{""id"": 237, ""name"": ""gay""}, {""id"": 392, ""name"": ""england""}, {""id"": 1956, ""name"": ""world war ii""}, {""id"": 2303, ""name"": ""mathematician""}, {""id"": 5565, ""name"": ""biography""}, {""id"": 208394, ""name"": ""logician""}, {""id"": 208395, ""name"": ""cryptography""}]",en,The Imitation Game,"Based on the real life story of legendary cryptanalyst Alan Turing, the film portrays the nail-biting race against time by Turing and his brilliant team of code-breakers at Britain's top-secret Government Code and Cypher School at Bletchley Park, during the darkest days of World War II.",145.364591,"[{""name"": ""Black Bear Pictures"", ""id"": 22146}, {""name"": ""Bristol Automotive"", ""id"": 38145}]","[{""iso_3166_1"": ""GB"", ""name"": ""United Kingdom""}]",2014-11-14,233555708,113.0,"[{""iso_639_1"": ""en"", ""name"": ""English""}]",Released,The true enigma was the man who cracked the code.,The Imitation Game,8.0,5723
15000000,"[{""id"": 14, ""name"": ""Fantasy""}, {""id"": 35, ""name"": ""Comedy""}]",,4011,"[{""id"": 3065, ""name"": ""minister""}, {""id"": 3891, ""name"": ""giant snake""}, {""id"": 4062, ""name"": ""skeleton""}, {""id"": 5941, ""name"": ""calypso""}, {""id"": 6022, ""name"": ""arts""}, {""id"": 6155, ""name"": ""afterlife""}, {""id"": 7925, ""name"": ""child bride""}, {""id"": 9712, ""name"": ""possession""}, {""id"": 9887, ""name"": ""surrealism""}, {""id"": 10809, ""name"": ""teenage girl""}, {""id"": 162846, ""name"": ""ghost""}]",en,Beetlejuice,"Thanks to an untimely demise via drowning, a young couple end up as poltergeists in their New England farmhouse, where they fail to meet the challenge of scaring away the insufferable new owners, who want to make drastic changes. In desperation, the undead newlyweds turn to an expert frightmeister, but he's got a diabolical agenda of his own.",58.553213,"[{""name"": ""Geffen Company, The"", ""id"": 4354}, {""name"": ""Warner Bros."", ""id"": 6194}]","[{""iso_3166_1"": ""US"", ""name"": ""United States of America""}]",1988-02-29,73326666,92.0,"[{""iso_639_1"": ""en"", ""name"": ""English""}]",Released,He's guaranteed to put some life in your afterlife.,Beetlejuice,7.1,1444
