budget,genres,homepage,id,keywords,original_language,original_title,overview,popularity,production_companies,production_countries,release_date,revenue,runtime,spoken_languages,status,tagline,title,vote_average,vote_count
237000000,"[{""id"": 28, ""name"": ""Action""}, {""id"": 12, ""name"": ""Adventure""}, {""id"": 14, ""name"": ""Fantasy""}, {""id"": 878, ""name"": ""Science Fiction""}]",http://www.avatarmovie.com/,19995,"[{""id"": 1463, ""name"": ""culture clash""}, {""id"": 2964, ""name"": ""future""}, {""id"": 3386, ""name"": ""space war""}, {""id"": 3388, ""name"": ""space colony""}, {""id"": 3679, ""name"": ""society""}, {""id"": 3801, ""name"": ""space travel""}, {""id"": 9685, ""name"": ""futuristic""}, {""id"": 9840, ""name"": ""romance""}, {""id"": 9882, ""name"": ""space""}, {""id"": 9951, ""name"": ""alien""}, {""id"": 10148, ""name"": ""tribe""}, {""id"": 10158, ""name"": ""alien planet""}, {""id"": 10987, ""name"": ""cgi""}, {""id"": 11399, ""name"": ""marine""}, {""id"": 13065, ""name"": ""soldier""}, {""id"": 14643, ""name"": ""battle""}, {""id"": 14720, ""name"": ""love affair""}, {""id"": 165431, ""name"": ""anti war""}, {""id"": 193554, ""name"": ""power relations""}, {""id"": 206690, ""name"": ""mind and soul""}, {""id"": 209714, ""name"": ""3d""}]",en,Avatar,"In the 22nd century, a paraplegic Marine is dispatched to the moon Pandora on a unique mission, but becomes torn between following orders and protecting an alien civilization.",150.437577,"[{""name"": ""Ingenious Film Partners"", ""id"": 289}, {""name"": ""Twentieth Century Fox Film Corporation"", ""id"": 306}, {""name"": ""Dune Entertainment"", ""id"": 444}, {""name"": ""Lightstorm Entertainment"", ""id"": 574}]","[{""iso_3166_1"": ""US"", ""name"": ""United States of America""}, {""iso_3166_1"": ""GB"", ""name"": ""United Kingdom""}]",2009-12-10,2787965087,162.0,"[{""iso_639_1"": ""en"", ""name"": ""English""}, {""iso_639_1"": ""es"", ""name"": ""Espa\u00f1ol""}]",Released,Enter the World of Pandora.,Avatar,7.2,11800
250000000,"[{""id"": 28, ""name"": ""Action""}, {""id"": 80, ""name"": ""Crime""}, {""id"": 18, ""name"": ""Drama""}, {""id"": 53, ""name"": ""Thriller""}]",http://www.thedarkknightrises.com/,49026,"[{""id"": 849, ""name"": ""dc comics""}, {""id"": 853, ""name"": ""crime fighter""}, {""id"": 949, ""name"": ""terrorist""}, {""id"": 1308, ""name"": ""secret identity""}, {""id"": 1437, ""name"": ""burglar""}, {""id"": 3051, ""name"": ""hostage drama""}, {""id"": 3562, ""name"": ""time bomb""}, {""id"": 6969, ""name"": ""gotham city""}, {""id"": 7002, ""name"": ""vigilante""}, {""id"": 9665, ""name"": ""cover-up""}, {""id"": 9715, ""name"": ""superhero""}, {""id"": 9990, ""name"": ""villainess""}, {""id"": 10044, ""name"": ""tragic hero""}, {""id"": 13015, ""name"": ""terrorism""}, {""id"": 14796, ""name"": ""destruction""}, {""id"": 18933, ""name"": ""catwoman""}, {""id"": 156082, ""name"": ""cat burglar""}, {""id"": 156395, ""name"": ""imax""}, {""id"": 173272, ""name"": ""flood""}, {""id"": 179093, ""name"": ""criminal underworld""}, {""id"": 230775, ""name"": ""batman""}]",en,The Dark Knight Rises,"Following the death of District Attorney Harvey Dent, Batman assumes responsibility for Dent's crimes to protect the late attorney's reputation and is subsequently hunted by the Gotham City Police Department. Eight years later, Batman encounters the mysterious Selina Kyle and the villainous Bane, a new terrorist leader who overwhelms Gotham's finest. The Dark Knight resurfaces to protect a city that has branded him an enemy.",112.31295,"[{""name"": ""Legendary Pictures"", ""id"": 923}, {""name"": ""Warner Bros."", ""id"": 6194}, {""name"": ""DC Entertainment"", ""id"": 9993}, {""name"": ""Syncopy"", ""id"": 9996}]","[{""iso_3166_1"": ""US"", ""name"": ""United States of America""}]",2012-07-16,1084939099,165.0,"[{""iso_639_1"": ""en"", ""name"": ""English""}]",Released,The Legend Ends,The Dark Knight Rises,7.6,9106
260000000,"[{""id"": 16, ""name"": ""Animation""}, {""id"": 10751, ""name"": ""Family""}]",http://disney.go.com/disneypictures/tangled/,38757,"[{""id"": 1562, ""name"": ""hostage""}, {""id"": 2343, ""name"": ""magic""}, {""id"": 2673, ""name"": ""horse""}, {""id"": 3205, ""name"": ""fairy tale""}, {""id"": 4344, ""name"": ""musical""}, {""id"": 7376, ""name"": ""princess""}, {""id"": 10336, ""name"": ""animation""}, {""id"": 33787, ""name"": ""tower""}, {""id"": 155658, ""name"": ""blonde woman""}, {""id"": 162219, ""name"": ""selfishness""}, {""id"": 163545, ""name"": ""healing power""}, {""id"": 179411, ""name"": ""based on fairy tale""}, {""id"": 179431, ""name"": ""duringcreditsstinger""}, {""id"": 215258, ""name"": ""healing gift""}, {""id"": 234183, ""name"": ""animal sidekick""}]",en,Tangled,"When the kingdom's most wanted-and most charming-bandit Flynn Rider hides out in a mysterious tower, he's taken hostage by Rapunzel, a beautiful and feisty tower-bound teen with 70 feet of magical, golden hair. Flynn's curious captor, who's looking for her ticket out of the tower where she's been locked away for years, strikes a deal with the handsome thief and the unlikely duo sets off on an action-packed escapade, complete with a super-cop horse, an over-protective chameleon and a gruff gang of pub thugs.",48.681969,"[{""name"": ""Walt Disney Pictures"", ""id"": 2}, {""name"": ""Walt Disney Animation Studios"", ""id"": 6125}]","[{""iso_3166_1"": ""US"", ""name"": ""United States of America""}]",2010-11-24,591794936,100.0,"[{""iso_639_1"": ""en"", ""name"": ""English""}]",Released,They're taking adventure to new lengths.,Tangled,7.4,3330
280000000,"[{""id"": 28, ""name"": ""Action""}, {""id"": 12, ""name"": ""Adventure""}, {""id"": 878, ""name"": ""Science Fiction""}]",http://marvel.com/movies/movie/193/avengers_age_of_ultron,99861,"[{""id"": 8828, ""name"": ""marvel comic""}, {""id"": 9663, ""name"": ""sequel""}, {""id"": 9715, ""name"": ""superhero""}, {""id"": 9717, ""name"": ""based on comic book""}, {""id"": 10629, ""name"": ""vision""}, {""id"": 155030, ""name"": ""superhero team""}, {""id"": 179431, ""name"": ""duringcreditsstinger""}, {""id"": 180547, ""name"": ""marvel cinematic universe""}, {""id"": 209714, ""name"": ""3d""}]",en,Avengers: Age of Ultron,"When Tony Stark tries to jumpstart a dormant peacekeeping program, things go awry and Earth’s Mightiest Heroes are put to the ultimate test as the fate of the planet hangs in the balance. As the villainous Ultron emerges, it is up to The Avengers to stop him from enacting his terrible plans, and soon uneasy alliances and unexpected action pave the way for an epic and unique global adventure.",134.279229,"[{""name"": ""Marvel Studios"", ""id"": 420}, {""name"": ""Prime Focus"", ""id"": 15357}, {""name"": ""Revolution Sun Studios"", ""id"": 76043}]","[{""iso_3166_1"": ""US"", ""name"": ""United States of America""}]",2015-04-22,1405403694,141.0,"[{""iso_639_1"": ""en"", ""name"": ""English""}]",Released,A New Age Has Come.,Avengers: Age of Ultron,7.3,6767
250000000,"[{""id"": 12, ""name"": ""Adventure""}, {""id"": 14, ""name"": ""Fantasy""}, {""id"": 10751, ""name"": ""Family""}]",http://harrypotter.warnerbros.com/harrypotterandthehalf-bloodprince/dvd/index.html,767,"[{""id"": 616, ""name"": ""witch""}, {""id"": 2343, ""name"": ""magic""}, {""id"": 3872, ""name"": ""broom""}, {""id"": 3884, ""name"": ""school of witchcraft""}, {""id"": 6333, ""name"": ""wizardry""}, {""id"": 10164, ""name"": ""apparition""}, {""id"": 10791, ""name"": ""teenage crush""}, {""id"": 12564, ""name"": ""werewolf""}]",en,Harry Potter and the Half-Blood Prince,"As Harry begins his sixth year at Hogwarts, he discovers an old book marked as 'Property of the Half-Blood Prince', and begins to learn more about Lord Voldemort's dark past.",98.885637,"[{""name"": ""Warner Bros."", ""id"": 6194}, {""name"": ""Heyday Films"", ""id"": 7364}]","[{""iso_3166_1"": ""GB"", ""name"": ""United Kingdom""}, {""iso_3166_1"": ""US"", ""name"": ""United States of America""}]",2009-07-07,933959197,153.0,"[{""iso_639_1"": ""en"", ""name"": ""English""}]",Released,Dark Secrets Revealed,Harry Potter and the Half-Blood Prince,7.4,5293
200000000,"[{""id"": 12, ""name"": ""Adventure""}, {""id"": 14, ""name"": ""Fantasy""}, {""id"": 28, ""name"": ""Action""}]",http://disney.go.com/disneypictures/pirates/,58,"[{""id"": 616, ""name"": ""witch""}, {""id"": 663, ""name"": ""fortune teller""}, {""id"": 910, ""name"": ""bondage""}, {""id"": 911, ""name"": ""exotic island""}, {""id"": 1299, ""name"": ""monster""}, {""id"": 1316, ""name"": ""captain""}, {""id"": 1317, ""name"": ""card game""}, {""id"": 1319, ""name"": ""east india trading company""}, {""id"": 1461, ""name"": ""compass""}, {""id"": 3799, ""name"": ""ship""}, {""id"": 5600, ""name"": ""daughter""}, {""id"": 12988, ""name"": ""pirate""}, {""id"": 157186, ""name"": ""swashbuckler""}, {""id"": 179430, ""name"": ""aftercreditsstinger""}]",en,Pirates of the Caribbean: Dead Man's Chest,"Captain Jack Sparrow works his way out of a blood debt with the ghostly Davey Jones, he also attempts to avoid eternal damnation.",145.847379,"[{""name"": ""Walt Disney Pictures"", ""id"": 2}, {""name"": ""Jerry Bruckheimer Films"", ""id"": 130}, {""name"": ""Second Mate Productions"", ""id"": 19936}]","[{""iso_3166_1"": ""JM"", ""name"": ""Jamaica""}, {""iso_3166_1"": ""US"", ""name"": ""United States of America""}, {""iso_3166_1"": ""BS"", ""name"": ""Bahamas""}, {""iso_3166_1"": ""DM"", ""name"": ""Dominica""}]",2006-06-20,1065659812,151.0,"[{""iso_639_1"": ""en"", ""name"": ""English""}, {""iso_639_1"": ""tr"", ""name"": ""T\u00fcrk\u00e7e""}, {""iso_639_1"": ""el"", ""name"": ""\u03b5\u03bb\u03bb\u03b7\u03bd\u03b9\u03ba\u03ac""}, {""iso_639_1"": ""zh"", ""name"": ""\u666e\u901a\u8bdd""}]",Released,Jack is back!,Pirates of the Caribbean: Dead Man's Chest,7.0,5246
220000000,"[{""id"": 878, ""name"": ""Science Fiction""}, {""id"": 28, ""name"": ""Action""}, {""id"": 12, ""name"": ""Adventure""}]",http://marvel.com/avengers_movie/,24428,"[{""id"": 242, ""name"": ""new york""}, {""id"": 5539, ""name"": ""shield""}, {""id"": 8828, ""name"": ""marvel comic""}, {""id"": 9715, ""name"": ""superhero""}, {""id"": 9717, ""name"": ""based on comic book""}, {""id"": 14909, ""name"": ""alien invasion""}, {""id"": 155030, ""name"": ""superhero team""}, {""id"": 179430, ""name"": ""aftercreditsstinger""}, {""id"": 179431, ""name"": ""duringcreditsstinger""}, {""id"": 180547, ""name"": ""marvel cinematic universe""}]",en,The Avengers,"When an unexpected enemy emerges and threatens global safety and security, Nick Fury, director of the international peacekeeping agency known as S.H.I.E.L.D., finds himself in need of a team to pull the world back from the brink of disaster. Spanning the globe, a daring recruitment effort begins!",144.448633,"[{""name"": ""Paramount Pictures"", ""id"": 4}, {""name"": ""Marvel Studios"", ""id"": 420}]","[{""iso_3166_1"": ""US"", ""name"": ""United States of America""}]",2012-04-25,1519557910,143.0,"[{""iso_639_1"": ""en"", ""name"": ""English""}]",Released,Some assembly required.,The Avengers,7.4,11776
250000000,"[{""id"": 28, ""name"": ""Action""}, {""id"": 12, ""name"": ""Adventure""}, {""id"": 14, ""name"": ""Fantasy""}]",http://www.thehobbit.com/,122917,"[{""id"": 417, ""name"": ""corruption""}, {""id"": 603, ""name"": ""elves""}, {""id"": 604, ""name"": ""dwarves""}, {""id"": 606, ""name"": ""orcs""}, {""id"": 609, ""name"": ""middle-earth (tolkien)""}, {""id"": 611, ""name"": ""hobbit""}, {""id"": 12554, ""name"": ""dragon""}, {""id"": 14643, ""name"": ""battle""}, {""id"": 167982, ""name"": ""unlikely friendship""}, {""id"": 188270, ""name"": ""epic battle""}, {""id"": 234213, ""name"": ""sword and sorcery""}]",en,The Hobbit: The Battle of the Five Armies,"Immediately after the events of The Desolation of Smaug, Bilbo and the dwarves try to defend Erebor's mountain of treasure from others who claim it: the men of the ruined Laketown and the elves of Mirkwood. Meanwhile an army of Orcs led by Azog the Defiler is marching on Erebor, fueled by the rise of the dark lord Sauron. Dwarves, elves and men must unite, and the hope for Middle-Earth falls into Bilbo's hands.",120.965743,"[{""name"": ""WingNut Films"", ""id"": 11}, {""name"": ""New Line Cinema"", ""id"": 12}, {""name"": ""Warner Bros. Pictures"", ""id"": 174}, {""name"": ""3Foot7"", ""id"": 7413}, {""name"": ""Metro-Goldwyn-Mayer (MGM)"", ""id"": 8411}]","[{""iso_3166_1"": ""NZ"", ""name"": ""New Zealand""}, {""iso_3166_1"": ""US"", ""name"": ""United States of America""}]",2014-12-10,956019788,144.0,"[{""iso_639_1"": ""en"", ""name"": ""English""}]",Released,Witness the defining chapter of the Middle-Earth saga,The Hobbit: The Battle of the Five Armies,7.1,4760
250000000,"[{""id"": 12, ""name"": ""Adventure""}, {""id"": 14, ""name"": ""Fantasy""}]",http://www.thehobbit.com/,57158,"[{""id"": 603, ""name"": ""elves""}, {""id"": 604, ""name"": ""dwarves""}, {""id"": 606, ""name"": ""orcs""}, {""id"": 611, ""name"": ""hobbit""}, {""id"": 12554, ""name"": ""dragon""}, {""id"": 177912, ""name"": ""wizard""}, {""id"": 234213, ""name"": ""sword and sorcery""}]",en,The Hobbit: The Desolation of Smaug,"The Dwarves, Bilbo and Gandalf have successfully escaped the Misty Mountains, and Bilbo has gained the One Ring. They all continue their journey to get their gold back from the Dragon, Smaug.",94.370564,"[{""name"": ""WingNut Films"", ""id"": 11}, {""name"": ""New Line Cinema"", ""id"": 12}, {""name"": ""Warner Bros. Pictures"", ""id"": 174}, {""name"": ""Metro-Goldwyn-Mayer (MGM)"", ""id"": 8411}]","[{""iso_3166_1"": ""NZ"", ""name"": ""New Zealand""}, {""iso_3166_1"": ""US"", ""name"": ""United States of America""}]",2013-12-11,958400000,161.0,"[{""iso_639_1"": ""en"", ""name"": ""English""}]",Released,Beyond darkness... beyond desolation... lies the greatest danger of all.,The Hobbit: The Desolation of Smaug,7.6,4524
200000000,"[{""id"": 18, ""name"": ""Drama""}, {""id"": 10749, ""name"": ""Romance""}, {""id"": 53, ""name"": ""Thriller""}]",http://www.titanicmovie.com,597,"[{""id"": 2580, ""name"": ""shipwreck""}, {""id"": 2984, ""name"": ""iceberg""}, {""id"": 3799, ""name"": ""ship""}, {""id"": 4210, ""name"": ""panic""}, {""id"": 4388, ""name"": ""titanic""}, {""id"": 4953, ""name"": ""ocean liner""}, {""id"": 6917, ""name"": ""epic""}, {""id"": 7579, ""name"": ""rich woman - poor man""}, {""id"": 9673, ""name"": ""love""}, {""id"": 10617, ""name"": ""disaster""}, {""id"": 10703, ""name"": ""tragic love""}, {""id"": 14514, ""name"": ""class differences""}, {""id"": 156395, ""name"": ""imax""}, {""id"": 165086, ""name"": ""star crossed lovers""}, {""id"": 182615, ""name"": ""steerage""}, {""id"": 182621, ""name"": ""salvage""}, {""id"": 182625, ""name"": ""rich snob""}, {""id"": 209714, ""name"": ""3d""}, {""id"": 210184, ""name"": ""1910s""}]",en,Titanic,"84 years later, a 101-year-old woman named Rose DeWitt Bukater tells the story to her granddaughter Lizzy Calvert, Brock Lovett, Lewis Bodine, Bobby Buell and Anatoly Mikailavich on the Keldysh about her life set in April 10th 1912, on a ship called Titanic when young Rose boards the departing ship with the upper-class passengers and her mother, Ruth DeWitt Bukater, and her fiancé, Caledon Hockley. Meanwhile, a drifter and artist named Jack Dawson and his best friend Fabrizio De Rossi win third-class tickets to the ship in a game. And she explains the whole story from departure until the death of Titanic on its first and last voyage April 15th, 1912 at 2:20 in the morning.",100.025899,"[{""name"": ""Paramount Pictures"", ""id"": 4}, {""name"": ""Twentieth Century Fox Film Corporation"", ""id"": 306}, {""name"": ""Lightstorm Entertainment"", ""id"": 574}]","[{""iso_3166_1"": ""US"", ""name"": ""United States of America""}]",1997-11-18,1845034188,194.0,"[{""iso_639_1"": ""en"", ""name"": ""English""}, {""iso_639_1"": ""fr"", ""name"": ""Fran\u00e7ais""}, {""iso_639_1"": ""de"", ""name"": ""Deutsch""}, {""iso_639_1"": ""sv"", ""name"": ""svenska""}, {""iso_639_1"": ""it"", ""name"": ""Italiano""}, {""iso_639_1"": ""ru"", ""name"": ""P\u0443\u0441\u0441\u043a\u0438\u0439""}]",Released,Nothing on Earth could come between them.,Titanic,7.5,7562
250000000,"[{""id"": 12, ""name"": ""Adventure""}, {""id"": 28, ""name"": ""Action""}, {""id"": 878, ""name"": ""Science Fiction""}]",http://marvel.com/captainamericapremiere,271110,"[{""id"": 393, ""name"": ""civil war""}, {""id"": 6091, ""name"": ""war""}, {""id"": 8828, ""name"": ""marvel comic""}, {""id"": 9663, ""name"": ""sequel""}, {""id"": 9715, ""name"": ""superhero""}, {""id"": 9717, ""name"": ""based on comic book""}, {""id"": 156395, ""name"": ""imax""}, {""id"": 179430, ""name"": ""aftercreditsstinger""}, {""id"": 179431, ""name"": ""duringcreditsstinger""}, {""id"": 180547, ""name"": ""marvel cinematic universe""}, {""id"": 209714, ""name"": ""3d""}]",en,Captain America: Civil War,"Following the events of Age of Ultron, the collective governments of the world pass an act designed to regulate all superhuman activity. This polarizes opinion amongst the Avengers, causing two factions to side with Iron Man or Captain America, which causes an epic battle between former allies.",198.372395,"[{""name"": ""Studio Babelsberg"", ""id"": 264}, {""name"": ""Marvel Studios"", ""id"": 420}, {""name"": ""Walt Disney Studios Motion Pictures"", ""id"": 3036}, {""name"": ""Vita-Ray Dutch Productions (III)"", ""id"": 84424}, {""name"": ""Deluxe Digital Studios"", ""id"": 84425}]","[{""iso_3166_1"": ""US"", ""name"": ""United States of America""}]",2016-04-27,1153304495,147.0,"[{""iso_639_1"": ""ro"", ""name"": ""Rom\u00e2n\u0103""}, {""iso_639_1"": ""en"", ""name"": ""English""}, {""iso_639_1"": ""de"", ""name"": ""Deutsch""}, {""iso_639_1"": ""ru"", ""name"": ""P\u0443\u0441\u0441\u043a\u0438\u0439""}]",Released,Divided We Fall,Captain America: Civil War,7.1,7241
200000000,"[{""id"": 16, ""name"": ""Animation""}, {""id"": 10751, ""name"": ""Family""}]",,62211,"[{""id"": 1299, ""name"": ""monster""}, {""id"": 5984, ""name"": ""dormitory""}, {""id"": 6186, ""name"": ""games""}, {""id"": 10336, ""name"": ""animation""}, {""id"": 12392, ""name"": ""best friend""}, {""id"": 13160, ""name"": ""university""}, {""id"": 163303, ""name"": ""scary""}, {""id"": 179430, ""name"": ""aftercreditsstinger""}]",en,Monsters University,A look at the relationship between Mike and Sulley during their days at Monsters University — when they weren't necessarily the best of friends.,89.186492,"[{""name"": ""Walt Disney Pictures"", ""id"": 2}, {""name"": ""Pixar Animation Studios"", ""id"": 3}]","[{""iso_3166_1"": ""US"", ""name"": ""United States of America""}]",2013-06-20,743559607,104.0,"[{""iso_639_1"": ""en"", ""name"": ""English""}]",Released,School never looked this scary.,Monsters University,7.0,3528
200000000,"[{""id"": 16, ""name"": ""Animation""}, {""id"": 10751, ""name"": ""Family""}, {""id"": 35, ""name"": ""Comedy""}]",http://disney.go.com/toystory/,10193,"[{""id"": 1562, ""name"": ""hostage""}, {""id"": 3616, ""name"": ""college""}, {""id"": 4290, ""name"": ""toy""}, {""id"": 5462, ""name"": ""barbie""}, {""id"": 10336, ""name"": ""animation""}, {""id"": 10685, ""name"": ""escape""}, {""id"": 33794, ""name"": ""day care""}, {""id"": 158162, ""name"": ""teddy bear""}, {""id"": 179431, ""name"": ""duringcreditsstinger""}, {""id"": 187065, ""name"": ""toy comes to life""}, {""id"": 209386, ""name"": ""personification""}, {""id"": 209387, ""name"": ""inanimate objects coming to life""}, {""id"": 224516, ""name"": ""toy story""}]",en,Toy Story 3,"Woody, Buzz, and the rest of Andy's toys haven't been played with in years. With Andy about to go to college, the gang find themselves accidentally left at a nefarious day care center. The toys must band together to escape and return home to Andy.",59.995418,"[{""name"": ""Walt Disney Pictures"", ""id"": 2}, {""name"": ""Pixar Animation Studios"", ""id"": 3}]","[{""iso_3166_1"": ""US"", ""name"": ""United States of America""}]",2010-06-16,1066969703,103.0,"[{""iso_639_1"": ""en"", ""name"": ""English""}, {""iso_639_1"": ""es"", ""name"": ""Espa\u00f1ol""}]",Released,No toy gets left behind.,Toy Story 3,7.6,4597
190000000,"[{""id"": 28, ""name"": ""Action""}]",http://www.furious7.com/,168259,"[{""id"": 830, ""name"": ""car race""}, {""id"": 3428, ""name"": ""speed""}, {""id"": 9748, ""name"": ""revenge""}, {""id"": 9937, ""name"": ""suspense""}, {""id"": 33885, ""name"": ""car""}, {""id"": 40870, ""name"": ""race""}, {""id"": 205399, ""name"": ""muscle car""}]",en,Furious 7,Deckard Shaw seeks revenge against Dominic Toretto and his family for his comatose brother.,102.322217,"[{""name"": ""Universal Pictures"", ""id"": 33}, {""name"": ""Original Film"", ""id"": 333}, {""name"": ""Fuji Television Network"", ""id"": 3341}, {""name"": ""Dentsu"", ""id"": 6452}, {""name"": ""One Race Films"", ""id"": 7154}, {""name"": ""China Film Co."", ""id"": 40890}, {""name"": ""Qu\u00e9bec Production Services Tax Credit"", ""id"": 86352}, {""name"": ""Media Rights Capital (MRC)"", ""id"": 86655}, {""name"": ""Abu Dhabi Film Commission"", ""id"": 87857}, {""name"": ""Colorado Office of Film, Television & Media"", ""id"": 87858}]","[{""iso_3166_1"": ""JP"", ""name"": ""Japan""}, {""iso_3166_1"": ""US"", ""name"": ""United States of America""}]",2015-04-01,1506249360,137.0,"[{""iso_639_1"": ""en"", ""name"": ""English""}]",Released,Vengeance Hits Home,Furious 7,7.3,4176
250000000,"[{""id"": 28, ""name"": ""Action""}, {""id"": 12, ""name"": ""Adventure""}, {""id"": 14, ""name"": ""Fantasy""}, {""id"": 878, ""name"": ""Science Fiction""}]",http://www.x-menmovies.com/,127585,"[{""id"": 1228, ""name"": ""1970s""}, {""id"": 1852, ""name"": ""mutant""}, {""id"": 4379, ""name"": ""time travel""}, {""id"": 8828, ""name"": ""marvel comic""}, {""id"": 9717, ""name"": ""based on comic book""}, {""id"": 10761, ""name"": ""superhuman""}, {""id"": 14527, ""name"": ""storm""}, {""id"": 161271, ""name"": ""beast""}, {""id"": 179430, ""name"": ""aftercreditsstinger""}, {""id"": 206736, ""name"": ""changing the past or future""}]",en,X-Men: Days of Future Past,The ultimate X-Men ensemble fights a war for the survival of the species across two time periods as they join forces with their younger selves in an epic battle that must change the past – to save our future.,118.078691,"[{""name"": ""Twentieth Century Fox Film Corporation"", ""id"": 306}, {""name"": ""Donners' Company"", ""id"": 431}, {""name"": ""Marvel Entertainment"", ""id"": 7505}, {""name"": ""Bad Hat Harry Productions"", ""id"": 9168}, {""name"": ""TSG Entertainment"", ""id"": 22213}, {""name"": ""Down Productions"", ""id"": 37336}, {""name"": ""Revolution Sun Studios"", ""id"": 76043}]","[{""iso_3166_1"": ""GB"", ""name"": ""United Kingdom""}, {""iso_3166_1"": ""US"", ""name"": ""United States of America""}]",2014-05-15,747862775,131.0,"[{""iso_639_1"": ""en"", ""name"": ""English""}]",Released,"To save the future, they must alter the past",X-Men: Days of Future Past,7.5,6032
190000000,"[{""id"": 28, ""name"": ""Action""}, {""id"": 12, ""name"": ""Adventure""}, {""id"": 878, ""name"": ""Science Fiction""}]",,54138,"[{""id"": 1612, ""name"": ""spacecraft""}, {""id"": 6054, ""name"": ""friendship""}, {""id"": 9663, ""name"": ""sequel""}, {""id"": 9685, ""name"": ""futuristic""}, {""id"": 9882, ""name"": ""space""}, {""id"": 9951, ""name"": ""alien""}, {""id"": 156395, ""name"": ""imax""}, {""id"": 161176, ""name"": ""space opera""}, {""id"": 179569, ""name"": ""terrorist bombing""}, {""id"": 209714, ""name"": ""3d""}]",en,Star Trek Into Darkness,"When the crew of the Enterprise is called back home, they find an unstoppable force of terror from within their own organization has detonated the fleet and everything it stands for, leaving our world in a state of crisis.  With a personal score to settle, Captain Kirk leads a manhunt to a war-zone world to capture a one man weapon of mass destruction. As our heroes are propelled into an epic chess game of life and death, love will be challenged, friendships will be torn apart, and sacrifices must be made for the only family Kirk has left: his crew.",78.291018,"[{""name"": ""Paramount Pictures"", ""id"": 4}, {""name"": ""Skydance Productions"", ""id"": 6277}, {""name"": ""Bad Robot"", ""id"": 11461}, {""name"": ""Kurtzman/Orci"", ""id"": 12536}]","[{""iso_3166_1"": ""US"", ""name"": ""United States of America""}]",2013-05-05,467365246,132.0,"[{""iso_639_1"": ""en"", ""name"": ""English""}]",Released,Earth Will Fall,Star Trek Into Darkness,7.4,4418
105000000,"[{""id"": 18, ""name"": ""Drama""}, {""id"": 10749, ""name"": ""Romance""}]",,64682,"[{""id"": 818, ""name"": ""based on novel""}, {""id"": 1326, ""name"": ""infidelity""}, {""id"": 1523, ""name"": ""obsession""}, {""id"": 3929, ""name"": ""hope""}, {""id"": 209714, ""name"": ""3d""}]",en,The Great Gatsby,"An adaptation of F. Scott Fitzgerald's Long Island-set novel, where Midwesterner Nick Carraway is lured into the lavish world of his neighbor, Jay Gatsby. Soon enough, however, Carraway will see through the cracks of Gatsby's nouveau riche existence, where obsession, madness, and tragedy await.",61.196071,"[{""name"": ""Village Roadshow Pictures"", ""id"": 79}, {""name"": ""Bazmark Films"", ""id"": 240}, {""name"": ""Warner Bros."", ""id"": 6194}, {""name"": ""A&E Television Networks"", ""id"": 11858}, {""name"": ""Red Wagon Entertainment"", ""id"": 14440}, {""name"": ""Spectrum Films"", ""id"": 14604}]","[{""iso_3166_1"": ""US"", ""name"": ""United States of America""}, {""iso_3166_1"": ""AU"", ""name"": ""Australia""}]",2013-05-10,351040419,143.0,"[{""iso_639_1"": ""en"", ""name"": ""English""}]",Released,Reserving judgments is a matter of infinite hope... I come to the admission that it has a limit.,The Great Gatsby,7.3,3769
