budget,genres,homepage,id,keywords,original_language,original_title,overview,popularity,production_companies,production_countries,release_date,revenue,runtime,spoken_languages,status,tagline,title,vote_average,vote_count
35000000,"[{""id"": 35, ""name"": ""Comedy""}, {""id"": 18, ""name"": ""Drama""}, {""id"": 10749, ""name"": ""Romance""}]",http://www.devilwearspradamovie.com/,350,"[{""id"": 90, ""name"": ""paris""}, {""id"": 736, ""name"": ""journalist""}, {""id"": 917, ""name"": ""journalism""}, {""id"": 1854, ""name"": ""world of fasion""}, {""id"": 3486, ""name"": ""fashion journal""}, {""id"": 3487, ""name"": ""assistant""}, {""id"": 3488, ""name"": ""job entrant""}, {""id"": 3489, ""name"": ""job interview""}, {""id"": 4222, ""name"": ""editor-in-chief""}]",en,The Devil Wears Prada,The Devil Wears Prada is about a young journalist who moves to New York to work in the fashion industry. Her boss however is extremely demanding and cruel and won’t let her succeed if she doesn’t fit into the high class elegant look of their magazine when all she really wants to be a good journalist.,83.893257,"[{""name"": ""Twentieth Century Fox Film Corporation"", ""id"": 306}, {""name"": ""Dune Entertainment"", ""id"": 444}, {""name"": ""Major Studio Partners"", ""id"": 445}, {""name"": ""Peninsula Films"", ""id"": 682}, {""name"": ""Fox 2000 Pictures"", ""id"": 711}]","[{""iso_3166_1"": ""US"", ""name"": ""United States of America""}]",2006-06-30,326551094,109.0,"[{""iso_639_1"": ""en"", ""name"": ""English""}, {""iso_639_1"": ""fr"", ""name"": ""Fran\u00e7ais""}]",Released,Meet Andy Sachs. A million girls would kill to have her job. She's not one of them.,The Devil Wears Prada,7.0,3088
35000000,"[{""id"": 80, ""name"": ""Crime""}, {""id"": 18, ""name"": ""Drama""}, {""id"": 9648, ""name"": ""Mystery""}, {""id"": 53, ""name"": ""Thriller""}]",,2118,"[{""id"": 417, ""name"": ""corruption""}, {""id"": 703, ""name"": ""detective""}, {""id"": 1366, ""name"": ""shotgun""}, {""id"": 10326, ""name"": ""morgue""}, {""id"": 11314, ""name"": ""f word""}, {""id"": 11925, ""name"": ""domestic violence""}, {""id"": 13092, ""name"": ""corpse""}, {""id"": 14536, ""name"": ""crime""}, {""id"": 33518, ""name"": ""district attorney""}, {""id"": 157325, ""name"": ""bandage""}, {""id"": 162262, ""name"": ""movie star""}, {""id"": 163335, ""name"": ""man with glasses""}, {""id"": 167145, ""name"": ""knife in thigh""}, {""id"": 167149, ""name"": ""good cop bad cop""}, {""id"": 167159, ""name"": ""switchblade""}, {""id"": 167164, ""name"": ""call girl""}, {""id"": 208611, ""name"": ""1950s""}, {""id"": 228495, ""name"": ""falsifying""}]",en,L.A. Confidential,Three detectives in the corrupt and brutal L.A. police force of the 1950s use differing methods to uncover a conspiracy behind the shotgun slayings of the patrons at an all-night diner.,24.860326,"[{""name"": ""Regency Enterprises"", ""id"": 508}, {""name"": ""Wolper Organization"", ""id"": 2428}, {""name"": ""Warner Bros."", ""id"": 6194}]","[{""iso_3166_1"": ""US"", ""name"": ""United States of America""}]",1997-09-19,126216940,138.0,"[{""iso_639_1"": ""en"", ""name"": ""English""}]",Released,Everything is suspect... Everyone is for sale... And nothing is what it seems.,L.A. Confidential,7.7,1310
1800000,"[{""id"": 27, ""name"": ""Horror""}]",,377,"[{""id"": 1468, ""name"": ""child murderer""}, {""id"": 2116, ""name"": ""sleep""}, {""id"": 3030, ""name"": ""nightmare""}, {""id"": 6152, ""name"": ""supernatural""}, {""id"": 12339, ""name"": ""slasher""}, {""id"": 13130, ""name"": ""teenager""}, {""id"": 18029, ""name"": ""trapped""}, {""id"": 33457, ""name"": ""alcoholic""}, {""id"": 157418, ""name"": ""boiler room""}, {""id"": 163841, ""name"": ""booby trap""}, {""id"": 170383, ""name"": ""disfigurement""}, {""id"": 171814, ""name"": ""medical test""}, {""id"": 225209, ""name"": ""dreams""}]",en,A Nightmare on Elm Street,"Teenagers in a small town are dropping like flies, apparently in the grip of mass hysteria causing their suicides. A cop's daughter, Nancy Thompson (Heather Langenkamp) traces the cause to child molester Fred Krueger (Robert Englund), who was burned alive by angry parents many years before. Krueger has now come back in the dreams of his killers' children, claiming their lives as his revenge. Nancy and her boyfriend, Glen (Johnny Depp), must devise a plan to lure the monster out of the realm of nightmares and into the real world...",38.204158,"[{""name"": ""New Line Cinema"", ""id"": 12}, {""name"": ""Smart Egg Pictures"", ""id"": 1531}]","[{""iso_3166_1"": ""US"", ""name"": ""United States of America""}]",1984-11-14,25504513,91.0,"[{""iso_639_1"": ""en"", ""name"": ""English""}]",Released,"If Nancy Doesn't Wake Up Screaming, She Won't Wake Up At All!",A Nightmare on Elm Street,7.2,1180
35000000,"[{""id"": 35, ""name"": ""Comedy""}, {""id"": 18, ""name"": ""Drama""}, {""id"": 36, ""name"": ""History""}]",,140823,"[{""id"": 5565, ""name"": ""biography""}, {""id"": 10336, ""name"": ""animation""}, {""id"": 13028, ""name"": ""writer""}, {""id"": 179429, ""name"": ""moviemaking""}]",en,Saving Mr. Banks,Author P.L. Travers travels from London to Hollywood as Walt Disney Pictures adapts her novel Mary Poppins for the big screen.,31.957947,"[{""name"": ""Walt Disney Pictures"", ""id"": 2}, {""name"": ""BBC Films"", ""id"": 288}, {""name"": ""Ruby Films"", ""id"": 2054}, {""name"": ""Essential Media & Entertainment"", ""id"": 6747}, {""name"": ""Hopscotch Features"", ""id"": 21079}]","[{""iso_3166_1"": ""AU"", ""name"": ""Australia""}, {""iso_3166_1"": ""GB"", ""name"": ""United Kingdom""}, {""iso_3166_1"": ""US"", ""name"": ""United States of America""}]",2013-11-16,112544580,125.0,"[{""iso_639_1"": ""en"", ""name"": ""English""}]",Released,"Where her book ended, their story began.",Saving Mr. Banks,7.3,1226
35000000,"[{""id"": 80, ""name"": ""Crime""}, {""id"": 18, ""name"": ""Drama""}, {""id"": 53, ""name"": ""Thriller""}]",,9366,"[{""id"": 1568, ""name"": ""undercover""}, {""id"": 2148, ""name"": ""colombia""}, {""id"": 10391, ""name"": ""mafia""}, {""id"": 11578, ""name"": ""mobster""}, {""id"": 11719, ""name"": ""dirty cop""}, {""id"": 167715, ""name"": ""informant""}, {""id"": 177554, ""name"": ""stealing money""}, {""id"": 177555, ""name"": ""marriage counselor""}, {""id"": 177565, ""name"": ""shaving cream""}, {""id"": 177571, ""name"": ""playing cards""}]",en,Donnie Brasco,An FBI undercover agent infilitrates the mob and finds himself identifying more with the mafia life at the expense of his regular one.,40.370442,"[{""name"": ""TriStar Pictures"", ""id"": 559}, {""name"": ""Mark Johnson Productions"", ""id"": 2604}, {""name"": ""Phoenix Pictures"", ""id"": 11317}, {""name"": ""Baltimore Pictures"", ""id"": 11407}]","[{""iso_3166_1"": ""US"", ""name"": ""United States of America""}]",1997-02-27,41954997,127.0,"[{""iso_639_1"": ""ja"", ""name"": ""\u65e5\u672c\u8a9e""}, {""iso_639_1"": ""en"", ""name"": ""English""}, {""iso_639_1"": ""it"", ""name"": ""Italiano""}]",Released,Based on a true story.,Donnie Brasco,7.4,1147
35000000,"[{""id"": 18, ""name"": ""Drama""}, {""id"": 10752, ""name"": ""War""}]",http://www.thepianistmovie.com/,423,"[{""id"": 30, ""name"": ""individual""}, {""id"": 836, ""name"": ""resistance""}, {""id"": 1224, ""name"": ""radio station""}, {""id"": 1327, ""name"": ""war crimes""}, {""id"": 1465, ""name"": ""loss of family""}, {""id"": 1468, ""name"": ""child murderer""}, {""id"": 1899, ""name"": ""hunger""}, {""id"": 1956, ""name"": ""world war ii""}, {""id"": 1968, ""name"": ""prisoners of war""}, {""id"": 2156, ""name"": ""homeland""}, {""id"": 2428, ""name"": ""deportation""}, {""id"": 2430, ""name"": ""hiding place""}, {""id"": 2431, ""name"": ""ghetto riot""}, {""id"": 2433, ""name"": ""jew persecution""}, {""id"": 2434, ""name"": ""liberation""}, {""id"": 2435, ""name"": ""warsaw ghetto""}, {""id"": 2436, ""name"": ""polish resistance""}, {""id"": 2652, ""name"": ""nazis""}, {""id"": 5565, ""name"": ""biography""}, {""id"": 5783, ""name"": ""classical music""}, {""id"": 11102, ""name"": ""panzer""}, {""id"": 14743, ""name"": ""pianist""}]",en,The Pianist,The Pianist is a film adapted from the biography of Wladyslaw Szpilman. A Jewish-Polish pianist who during the second world war lived and hid miraculously in Warsaw after having gone through a terrible tragedy. A film from Roman Polanski.,50.587541,"[{""name"": ""Bac Films"", ""id"": 208}, {""name"": ""Canal+Polska"", ""id"": 250}, {""name"": ""Heritage Films"", ""id"": 260}, {""name"": ""Studio Babelsberg"", ""id"": 264}, {""name"": ""Agencja Produkcji Filmowej"", ""id"": 266}, {""name"": ""Beverly Detroit"", ""id"": 267}, {""name"": ""FilmFernsehFonds Bayern"", ""id"": 268}, {""name"": ""Filmboard Berlin-Brandenburg (FBB)"", ""id"": 269}, {""name"": ""Mainstream S.A."", ""id"": 271}, {""name"": ""R.P. Productions"", ""id"": 355}, {""name"": ""StudioCanal"", ""id"": 694}, {""name"": ""Filmf\u00f6rderungsanstalt (FFA)"", ""id"": 4247}, {""name"": ""Canal+"", ""id"": 5358}, {""name"": ""Interscope Communications"", ""id"": 10201}, {""name"": ""Telewizja Polska (TVP)"", ""id"": 19150}, {""name"": ""Runteam"", ""id"": 31087}]","[{""iso_3166_1"": ""FR"", ""name"": ""France""}, {""iso_3166_1"": ""DE"", ""name"": ""Germany""}, {""iso_3166_1"": ""PL"", ""name"": ""Poland""}, {""iso_3166_1"": ""GB"", ""name"": ""United Kingdom""}]",2002-09-24,120072577,150.0,"[{""iso_639_1"": ""en"", ""name"": ""English""}, {""iso_639_1"": ""de"", ""name"": ""Deutsch""}, {""iso_639_1"": ""ru"", ""name"": ""P\u0443\u0441\u0441\u043a\u0438\u0439""}]",Released,Music was his passion. Survival was his masterpiece.,The Pianist,8.0,1864
34000000,"[{""id"": 28, ""name"": ""Action""}, {""id"": 9648, ""name"": ""Mystery""}, {""id"": 878, ""name"": ""Science Fiction""}, {""id"": 53, ""name"": ""Thriller""}]",http://themazerunnermovie.com/,198663,"[{""id"": 818, ""name"": ""based on novel""}, {""id"": 2158, ""name"": ""maze""}, {""id"": 4458, ""name"": ""post-apocalyptic""}, {""id"": 4565, ""name"": ""dystopia""}, {""id"": 10685, ""name"": ""escape""}, {""id"": 11469, ""name"": ""memory loss""}, {""id"": 15261, ""name"": ""erased memory""}, {""id"": 18029, ""name"": ""trapped""}, {""id"": 162988, ""name"": ""dystopic future""}, {""id"": 204967, ""name"": ""runner""}, {""id"": 223438, ""name"": ""based on young adult novel""}]",en,The Maze Runner,"Set in a post-apocalyptic world, young Thomas is deposited in a community of boys after his memory is erased, soon learning they're all trapped in a maze that will require him to join forces with fellow ""runners"" for a shot at escape.",131.815575,"[{""name"": ""Ingenious Media"", ""id"": 290}, {""name"": ""Twentieth Century Fox Film Corporation"", ""id"": 306}, {""name"": ""Gotham Group"", ""id"": 3672}, {""name"": ""Dayday Films"", ""id"": 8569}, {""name"": ""Temple Hill Entertainment"", ""id"": 12292}, {""name"": ""TSG Entertainment"", ""id"": 22213}]","[{""iso_3166_1"": ""US"", ""name"": ""United States of America""}]",2014-09-10,348319861,113.0,"[{""iso_639_1"": ""en"", ""name"": ""English""}]",Released,Run - Remember - Survive,The Maze Runner,7.0,5371
34000000,"[{""id"": 18, ""name"": ""Drama""}, {""id"": 10749, ""name"": ""Romance""}]",,228205,"[{""id"": 818, ""name"": ""based on novel""}, {""id"": 9082, ""name"": ""art student""}, {""id"": 155291, ""name"": ""cowboy""}, {""id"": 158591, ""name"": ""injury""}, {""id"": 190078, ""name"": ""bull riding""}, {""id"": 191100, ""name"": ""romantic drama""}, {""id"": 206298, ""name"": ""young adult""}]",en,The Longest Ride,The lives of a young couple intertwine with a much older man as he reflects back on a lost love while he's trapped in an automobile crash.,41.946523,"[{""name"": ""Fox 2000 Pictures"", ""id"": 711}, {""name"": ""Temple Hill Entertainment"", ""id"": 12292}]","[{""iso_3166_1"": ""US"", ""name"": ""United States of America""}]",2015-04-09,63013281,128.0,"[{""iso_639_1"": ""en"", ""name"": ""English""}]",Released,Two couples. Two love stories. One epic tale.,The Longest Ride,7.3,1064
32350000,"[{""id"": 12, ""name"": ""Adventure""}, {""id"": 28, ""name"": ""Action""}, {""id"": 878, ""name"": ""Science Fiction""}]",http://www.starwars.com/films/star-wars-episode-vi-return-of-the-jedi,1892,"[{""id"": 526, ""name"": ""rebel""}, {""id"": 1155, ""name"": ""brother sister relationship""}, {""id"": 2280, ""name"": ""emperor""}, {""id"": 2902, ""name"": ""space battle""}, {""id"": 5144, ""name"": ""matter of life and death""}, {""id"": 9831, ""name"": ""spaceship""}, {""id"": 10013, ""name"": ""death star""}, {""id"": 10014, ""name"": ""jabba the hutt""}, {""id"": 10015, ""name"": ""ewoks""}, {""id"": 10527, ""name"": ""jedi""}, {""id"": 161176, ""name"": ""space opera""}]",en,Return of the Jedi,"As Rebel leaders map their strategy for an all-out attack on the Emperor's newer, bigger Death Star. Han Solo remains frozen in the cavernous desert fortress of Jabba the Hutt, the most loathsome outlaw in the universe, who is also keeping Princess Leia as a slave girl. Now a master of the Force, Luke Skywalker rescues his friends, but he cannot become a true Jedi Knight until he wages his own crucial battle against Darth Vader, who has sworn to win Luke over to the dark side of the Force.",46.509071,"[{""name"": ""Lucasfilm"", ""id"": 1}, {""name"": ""Twentieth Century Fox Film Corporation"", ""id"": 306}]","[{""iso_3166_1"": ""US"", ""name"": ""United States of America""}]",1983-05-23,572700000,135.0,"[{""iso_639_1"": ""en"", ""name"": ""English""}]",Released,The Empire Falls...,Return of the Jedi,7.9,4665
32000000,"[{""id"": 53, ""name"": ""Thriller""}, {""id"": 878, ""name"": ""Science Fiction""}, {""id"": 9648, ""name"": ""Mystery""}]",http://www.enterthesourcecode.com/,45612,"[{""id"": 258, ""name"": ""bomb""}, {""id"": 1284, ""name"": ""identity""}, {""id"": 2486, ""name"": ""fantasy""}, {""id"": 2532, ""name"": ""bomber""}, {""id"": 3301, ""name"": ""suspicion""}, {""id"": 4379, ""name"": ""time travel""}, {""id"": 5340, ""name"": ""investigation""}, {""id"": 9887, ""name"": ""surrealism""}, {""id"": 13065, ""name"": ""soldier""}, {""id"": 14605, ""name"": ""helicopter pilot""}]",en,Source Code,"Decorated soldier Captain Colter Stevens wakes up in the body of an unknown man, discovering he's involved in a mission to find the bomber of a Chicago commuter train. He learns he's part of a top-secret experimental program that enables him to experience the final 8 minutes of another person's life. Colter re-lives the train incident over and over again, gathering more clues each time. But can he discover who is responsible for the attack before the next one happens?",59.19888,"[{""name"": ""The Mark Gordon Company"", ""id"": 1557}, {""name"": ""Vendome Pictures"", ""id"": 7460}]","[{""iso_3166_1"": ""CA"", ""name"": ""Canada""}, {""iso_3166_1"": ""US"", ""name"": ""United States of America""}]",2011-03-30,147332697,93.0,"[{""iso_639_1"": ""en"", ""name"": ""English""}]",Released,Make Every Second Count,Source Code,7.1,2699
31500000,"[{""id"": 18, ""name"": ""Drama""}, {""id"": 10752, ""name"": ""War""}]",http://www.apocalypsenow.com,28,"[{""id"": 1008, ""name"": ""guerrilla""}, {""id"": 1261, ""name"": ""river""}, {""id"": 2956, ""name"": ""vietnam""}, {""id"": 2959, ""name"": ""vietcong""}, {""id"": 2960, ""name"": ""cambodia""}, {""id"": 6092, ""name"": ""army""}, {""id"": 6255, ""name"": ""insanity""}, {""id"": 10148, ""name"": ""tribe""}, {""id"": 10403, ""name"": ""green beret""}, {""id"": 10787, ""name"": ""jungle""}, {""id"": 12332, ""name"": ""apocalypse""}, {""id"": 34079, ""name"": ""death""}, {""id"": 177275, ""name"": ""napalm""}]",en,Apocalypse Now,"At the height of the Vietnam war, Captain Benjamin Willard is sent on a dangerous mission that, officially, ""does not exist, nor will it ever exist."" His goal is to locate - and eliminate - a mysterious Green Beret Colonel named Walter Kurtz, who has been leading his personal army on illegal guerrilla missions into enemy territory.",49.973462,"[{""name"": ""United Artists"", ""id"": 60}, {""name"": ""Zoetrope Studios"", ""id"": 26663}]","[{""iso_3166_1"": ""US"", ""name"": ""United States of America""}]",1979-08-15,89460381,153.0,"[{""iso_639_1"": ""km"", ""name"": """"}, {""iso_639_1"": ""en"", ""name"": ""English""}, {""iso_639_1"": ""fr"", ""name"": ""Fran\u00e7ais""}, {""iso_639_1"": ""vi"", ""name"": ""Ti\u1ebfng Vi\u1ec7t""}]",Released,This is the end...,Apocalypse Now,8.0,2055
30000000,"[{""id"": 35, ""name"": ""Comedy""}, {""id"": 18, ""name"": ""Drama""}]",,120467,"[{""id"": 612, ""name"": ""hotel""}, {""id"": 5918, ""name"": ""painting""}, {""id"": 11159, ""name"": ""wartime""}, {""id"": 12371, ""name"": ""gunfight""}, {""id"": 14604, ""name"": ""theft""}, {""id"": 172772, ""name"": ""mentor prot\u00e9g\u00e9 relationship""}, {""id"": 181046, ""name"": ""european""}, {""id"": 188688, ""name"": ""hotel lobby""}, {""id"": 207257, ""name"": ""renaissance painting""}]",en,The Grand Budapest Hotel,"The Grand Budapest Hotel tells of a legendary concierge at a famous European hotel between the wars and his friendship with a young employee who becomes his trusted protégé. The story involves the theft and recovery of a priceless Renaissance painting, the battle for an enormous family fortune and the slow and then sudden upheavals that transformed Europe during the first half of the 20th century.",74.417456,"[{""name"": ""Fox Searchlight Pictures"", ""id"": 43}, {""name"": ""Scott Rudin Productions"", ""id"": 258}, {""name"": ""Studio Babelsberg"", ""id"": 264}, {""name"": ""Indian Paintbrush"", ""id"": 9350}, {""name"": ""TSG Entertainment"", ""id"": 22213}, {""name"": ""American Empirical Pictures"", ""id"": 23449}]","[{""iso_3166_1"": ""GB"", ""name"": ""United Kingdom""}, {""iso_3166_1"": ""US"", ""name"": ""United States of America""}, {""iso_3166_1"": ""DE"", ""name"": ""Germany""}]",2014-02-26,174600318,99.0,"[{""iso_639_1"": ""en"", ""name"": ""English""}, {""iso_639_1"": ""fr"", ""name"": ""Fran\u00e7ais""}]",Released,A perfect holiday without leaving home.,The Grand Budapest Hotel,8.0,4519
30000000,"[{""id"": 16, ""name"": ""Animation""}, {""id"": 35, ""name"": ""Comedy""}, {""id"": 10751, ""name"": ""Family""}]",http://toystory.disney.com/toy-story,862,"[{""id"": 931, ""name"": ""jealousy""}, {""id"": 4290, ""name"": ""toy""}, {""id"": 5202, ""name"": ""boy""}, {""id"": 6054, ""name"": ""friendship""}, {""id"": 9713, ""name"": ""friends""}, {""id"": 9823, ""name"": ""rivalry""}, {""id"": 165503, ""name"": ""boy next door""}, {""id"": 170722, ""name"": ""new toy""}, {""id"": 187065, ""name"": ""toy comes to life""}]",en,Toy Story,"Led by Woody, Andy's toys live happily in his room until Andy's birthday brings Buzz Lightyear onto the scene. Afraid of losing his place in Andy's heart, Woody plots against Buzz. But when circumstances separate Buzz and Woody from their owner, the duo eventually learns to put aside their differences.",73.640445,"[{""name"": ""Pixar Animation Studios"", ""id"": 3}]","[{""iso_3166_1"": ""US"", ""name"": ""United States of America""}]",1995-10-30,373554033,81.0,"[{""iso_639_1"": ""en"", ""name"": ""English""}]",Released,,Toy Story,7.7,5269
30000000,"[{""id"": 18, ""name"": ""Drama""}, {""id"": 10749, ""name"": ""Romance""}]",,72570,"[{""id"": 732, ""name"": ""coma""}, {""id"": 1453, ""name"": ""amnesia""}, {""id"": 9672, ""name"": ""based on true story""}, {""id"": 11469, ""name"": ""memory loss""}, {""id"": 13063, ""name"": ""car accident""}, {""id"": 191100, ""name"": ""romantic drama""}]",en,The Vow,"Happy young married couple Paige and Leo are, well, happy. Then a car accident puts Paige into a life-threatening coma. Upon awakening she has lost the previous five years of memories, including those of her beloved Leo, her wedding, a confusing relationship with her parents, or the ending of her relationship with her ex-fiance. Despite these complications, Leo endeavors to win her heart again and rebuild their marriage.",26.780961,"[{""name"": ""Spyglass Entertainment"", ""id"": 158}, {""name"": ""Screen Gems"", ""id"": 3287}]","[{""iso_3166_1"": ""US"", ""name"": ""United States of America""}]",2012-02-05,196114570,104.0,"[{""iso_639_1"": ""en"", ""name"": ""English""}]",Released,,The Vow,7.0,1293
25000000,"[{""id"": 18, ""name"": ""Drama""}]",,132363,"[{""id"": 833, ""name"": ""white house""}, {""id"": 1307, ""name"": ""butler""}, {""id"": 5565, ""name"": ""biography""}, {""id"": 163116, ""name"": ""civil rights""}]",en,The Butler,"A look at the life of Cecil Gaines who served eight presidents as the White House's head butler from 1952 to 1986, and had a unique front-row seat as political and racial history was made.",32.105328,"[{""name"": ""Laura Ziskin Productions"", ""id"": 326}, {""name"": ""Lee Daniels Entertainment"", ""id"": 695}, {""name"": ""Follow Through Productions"", ""id"": 18919}, {""name"": ""Salamander Pictures"", ""id"": 18920}, {""name"": ""Pam Williams Productions"", ""id"": 18921}, {""name"": ""Windy Hill Pictures"", ""id"": 18922}]","[{""iso_3166_1"": ""US"", ""name"": ""United States of America""}]",2013-08-16,115922175,132.0,"[{""iso_639_1"": ""en"", ""name"": ""English""}]",Released,One quiet voice can ignite a revolution.,The Butler,7.2,1101
33000000,"[{""id"": 80, ""name"": ""Crime""}, {""id"": 9648, ""name"": ""Mystery""}, {""id"": 53, ""name"": ""Thriller""}]",http://www.sevenmovie.com/,807,"[{""id"": 476, ""name"": ""self-fulfilling prophecy""}, {""id"": 703, ""name"": ""detective""}, {""id"": 1470, ""name"": ""s.w.a.t.""}, {""id"": 2231, ""name"": ""drug dealer""}, {""id"": 3597, ""name"": ""evisceration""}, {""id"": 3857, ""name"": ""lust and impulsiveness""}, {""id"": 3927, ""name"": ""rage and hate""}, {""id"": 3932, ""name"": ""pride and vanity""}, {""id"": 4138, ""name"": ""immoderateness""}, {""id"": 4142, ""name"": ""insomnia""}, {""id"": 5340, ""name"": ""investigation""}, {""id"": 6125, ""name"": ""pension""}, {""id"": 6149, ""name"": ""police""}, {""id"": 10714, ""name"": ""serial killer""}]",en,Se7en,"Two homicide detectives are on a desperate hunt for a serial killer whose crimes are based on the ""seven deadly sins"" in this dark and haunting film that takes viewers from the tortured remains of one victim to the next. The seasoned Det. Sommerset researches each sin in an effort to get inside the killer's mind, while his novice partner, Mills, scoffs at his efforts to unravel the case.",79.579532,"[{""name"": ""New Line Cinema"", ""id"": 12}, {""name"": ""Juno Pix"", ""id"": 4286}, {""name"": ""Cecchi Gori Pictures"", ""id"": 65394}]","[{""iso_3166_1"": ""US"", ""name"": ""United States of America""}]",1995-09-22,327311859,127.0,"[{""iso_639_1"": ""en"", ""name"": ""English""}]",Released,Seven deadly sins. Seven ways to die.,Se7en,8.1,5765
30000000,"[{""id"": 878, ""name"": ""Science Fiction""}]",http://www.d-9.com/,17654,"[{""id"": 100, ""name"": ""slum""}, {""id"": 542, ""name"": ""street gang""}, {""id"": 2766, ""name"": ""mutation""}, {""id"": 3644, ""name"": ""south africa""}, {""id"": 4339, ""name"": ""johannesburg""}, {""id"": 4565, ""name"": ""dystopia""}, {""id"": 6017, ""name"": ""genetics""}, {""id"": 6086, ""name"": ""government""}, {""id"": 8201, ""name"": ""satire""}, {""id"": 9951, ""name"": ""alien""}, {""id"": 10650, ""name"": ""prawn""}, {""id"": 11800, ""name"": ""mockumentary""}, {""id"": 12026, ""name"": ""alternate history""}, {""id"": 12425, ""name"": ""racism""}, {""id"": 158276, ""name"": ""metamorphosis""}, {""id"": 160910, ""name"": ""xenophobia""}, {""id"": 195139, ""name"": ""internment camp""}, {""id"": 229740, ""name"": ""body transformation""}, {""id"": 231277, ""name"": ""alien technology""}, {""id"": 233016, ""name"": ""segregation""}]",en,District 9,"Aliens land in South Africa and, with their ship totally disabled,  have no way home. Years later, after living in a slum and wearing out their welcome the 'Non-Humans' are being moved to a new tent city overseen by Multi-National United (MNU).",63.13678,"[{""name"": ""WingNut Films"", ""id"": 11}, {""name"": ""TriStar Pictures"", ""id"": 559}, {""name"": ""Key Creatives"", ""id"": 2300}, {""name"": ""Block / Hanson"", ""id"": 8504}, {""name"": ""Canadian Film or Video Production Tax Credit (CPTC)"", ""id"": 8582}, {""name"": ""The Department of Trade and Industry of South Africa"", ""id"": 10884}, {""name"": ""QED International"", ""id"": 11029}, {""name"": ""Province of British Columbia Production Services Tax Credit"", ""id"": 12200}, {""name"": ""District 9"", ""id"": 20667}, {""name"": ""New Zealand Post Digital and Visual Effects Grant"", ""id"": 20668}]","[{""iso_3166_1"": ""US"", ""name"": ""United States of America""}, {""iso_3166_1"": ""NZ"", ""name"": ""New Zealand""}, {""iso_3166_1"": ""CA"", ""name"": ""Canada""}, {""iso_3166_1"": ""ZA"", ""name"": ""South Africa""}]",2009-08-05,210819611,112.0,"[{""iso_639_1"": ""af"", ""name"": ""Afrikaans""}, {""iso_639_1"": ""ny"", ""name"": """"}, {""iso_639_1"": ""st"", ""name"": """"}, {""iso_639_1"": ""xh"", ""name"": """"}, {""iso_639_1"": ""zu"", ""name"": ""isiZulu""}, {""iso_639_1"": ""en"", ""name"": ""English""}]",Released,You are not welcome here.,District 9,7.3,3382
